title,description,brand,asin,image,rating,nReviews,keywords
"BLACK+DECKER FusionBlade Personal Blender with Two 20oz Personal Blending Jars, Gray, PB1002G","['Create personalized blended drinks with the BLACK+DECKER FusionBlade Personal Blender. Perfect for single servings, the blender comes with a pair of 20oz jars with twist-on travel lids to keep your beverages in place no matter where you go. The powerful stainless steel FusionBlade makes customized beverages for any occasion. Its designed to crush ice and blend foods and liquids evenly so you can mix some drinks for a night in or create a protein shake to take to the gym.']",BLACK+DECKER,B00LU2HZJQ,"['https://images-na.ssl-images-amazon.com/images/I/41iqjYah9mL._SS40_.jpg', 'https://images-na.ssl-images-amazon.com/images/I/51NFHYF8V1L._SS40_.jpg', 'https://images-na.ssl-images-amazon.com/images/I/51ART-4T-1L._SS40_.jpg', 'https://images-na.ssl-images-amazon.com/images/I/41OZT%2B5NNUL._SS40_.jpg', 'https://images-na.ssl-images-amazon.com/images/I/51%2BhetJd-xL._SS40_.jpg', 'https://images-na.ssl-images-amazon.com/images/I/41IogoMCC4L._SS36_.jpg']",5.0,6.0,"['perfect', 'powerful', 'twist', 'jars', 'drinks', 'g', 'night', 'stainless', 'gray', 'blender', 'servings', 'travel', 'pair', 'ice', 'liquids', 'black+decker', 'fusionblade', 'lids', 'oz', 'foods', 'single', 'occasion', 'beverages', 'steel', 'place', 'pb1002', 'protein', 'gym', 'blended', 'personal', 'blending']"
"Rachael Ray Expandable Lasagna Lugger, Double Casserole Carrier for Potluck Parties, Picnics, Tailgates - Fits two 9""x13"" Casserole Dishes, Red","[""The ultimate carrier for hot and cold food transport - the Expandable Lasagna Lugger by Rachael Ray expands to hold two 9 inch X 13 inch baking dishes (dishes not included). Need to feed a crowd? This insulated meal carrier is great for transporting your favorite meals, casseroles and desserts to parties, potlucks, tailgates and picnics. It's also great to use at home when you need to keep food hot or cold until your guests arrive. Constructed of built-to-last, 600 denier material with Triple-Tek insulation and leak proof, easy clean Temperfoil lining for excellent retention of heat and cold! Measures 16.5L X 10.5W X 6.8H""]",Rachael Ray,B00G7NVCHE,"['https://images-na.ssl-images-amazon.com/images/I/41h84lfiwBL._SS40_.jpg', 'https://images-na.ssl-images-amazon.com/images/I/51itMz4XgmL._SS40_.jpg', 'https://images-na.ssl-images-amazon.com/images/I/51rRr1d5sAL._SS40_.jpg', 'https://images-na.ssl-images-amazon.com/images/I/51gljgdAFnL._SS40_.jpg', 'https://images-na.ssl-images-amazon.com/images/I/51XZ-ncw54L._SS36_.jpg', 'https://images-na.ssl-images-amazon.com/images/I/51OfTOjzx0L._SS36_.jpg', 'https://images-na.ssl-images-amazon.com/images/I/41iWW%2Bkwd7L._SS36_.jpg', 'https://images-na.ssl-images-amazon.com/images/I/51Mv%2BmnD%2BFL._SS36_.jpg', 'https://images-na.ssl-images-amazon.com/images/I/51vYn-HAdCL._SS36_.jpg', 'https://images-na.ssl-images-amazon.com/images/I/51ypWU8ltuL._SS36_.jpg', 'https://images-na.ssl-images-amazon.com/images/I/51l2X1G-vUL._SS36_.jpg']",5.0,9.0,"['easy', 'hot', 'lugger', 'rachael', 'potlucks', 'insulation', 'leak', 'picnics', 'heat', 'baking', 'guests', 'carrier', 'lasagna', 'casserole', 'parties', 'tailgates', 'proof', 'dishes', 'excellent', 'crowd', 'great', 'measures', 'double', 'home', 'tek', 'meals', 'favorite', 'food', 'temperfoil', 'potluck', 'inch', 'desserts', 'meal', 'ultimate', 'transport', 'retention', 'expandable', 'triple', 'denier', 'clean', 'casseroles', 'material', 'ray', 'cold']"
"Tovolo Sweet Treats Tub, Tight-Fitting Silicone Lid, Stack Easily, Lemon","[""Keep your favorite ice cream, gelato or sorbet at the ready for you to dive in to. Our 1 quart Sweet Treat Tubs are great for letting everyone create their favorite mix-ins to add to homemade frozen desserts. The silicone lid goes on and off easily and keep your homemade treats fresh. Go ahead, eat straight from the tub, we won't tell. At Tovolo, we believe time spent cooking should be fun and we are honored to be a part of that experience in each home that uses our products. We challenge ourselves to improve the performance, function, and appearance of kitchen tools. Something as simple as a silicone spatula moves us to create the perfect experience for our customers. We obsess over every detail to ensure that our spatula will outperform expectations. However, performance alone is not enough; we want to put a smile on the customers face as well. Whether it is our Spatulart silicone spatulas, our assortment of frozen pop molds or our whimsically shaped ice molds, we strive to add a colorful element of fun to each of our items, to do just that.""]",Tovolo,B00JQNCALE,"['https://images-na.ssl-images-amazon.com/images/I/41EQfm2aP3L._SS40_.jpg', 'https://images-na.ssl-images-amazon.com/images/I/21ocI-ZWd5L._SS40_.jpg', 'https://images-na.ssl-images-amazon.com/images/I/31Kl0UZ42SL._SS40_.jpg', 'https://images-na.ssl-images-amazon.com/images/I/310vj37kG8L._SS36_.jpg', 'https://images-na.ssl-images-amazon.com/images/I/31CpyL3DErL._SS36_.jpg', 'https://images-na.ssl-images-amazon.com/images/I/31mdqwweOGL._SS36_.jpg', 'https://images-na.ssl-images-amazon.com/images/I/31NTnxXz5XL._SS36_.jpg', 'https://images-na.ssl-images-amazon.com/images/I/318sy6gse5L._SS36_.jpg']",5.0,5.0,"['quart', 'perfect', 'tub', 'smile', 'lemon', 'cooking', 'molds', 'sweet', 'fun', 'treat', 'colorful', 'tovolo', 'spatula', 'products', 'silicone', 'tight', 'homemade', 'detail', 'pop', 'cream', 'performance', 'ice', 'sorbet', 'kitchen', 'ins', 'time', 'assortment', 'great', 'fresh', 'frozen', 'home', 'tubs', 'element', 'lid', 'experience', 'treats', 'customers', 'function', 'gelato', 'items', 'spatulas', 'favorite', 'desserts', 'simple', 'appearance', 'tools', 'expectations', 'spatulart', 'mix', 'ready']"
Stainless Steel Kitchen Countertop Compost Bin with Silicone Grip - 1 Gallon,"['""We love composting as much as you do and that\'s why we made sure to pay attention to every detail when designing this Kitchen Compost Keeper. From the all Stainless Steel construction that\'s odorless and designed to never rust, to the double-thick charcoal filter to make sure your home never smells like compost. At Earth Cycle we know that there is beauty in everyday things, and we designed our composter to be an elegant part of your home. We stand by everything we make with a lifetime guarantee. Cheers to an amazing garden.""']",EarthCycle Compost Bin,B00R9OPB5O,"['https://images-na.ssl-images-amazon.com/images/I/41IIFaTterL._SS40_.jpg', 'https://images-na.ssl-images-amazon.com/images/I/41%2B%2BxVwk2DL._SS40_.jpg', 'https://images-na.ssl-images-amazon.com/images/I/41VKWsdMFwL._SS40_.jpg', 'https://images-na.ssl-images-amazon.com/images/I/410AKZtAn4L._SS40_.jpg']",5.0,5.0,"['sure', 'guarantee', 'charcoal', 'things', 'filter', 'earth', 'silicone', 'detail', 'countertop', 'compost', 'cheers', 'elegant', 'kitchen', 'lifetime', 'composter', 'double', 'home', 'beauty', 'thick', 'everyday', 'garden', 'amazing', 'odorless', 'steel', 'gallon', 'composting', 'bin', 'grip', 'attention', 'cycle', 'keeper', 'construction', 'stainless']"
Wilton 417-2589 40-Piece Fondant Alphabet Number Cutouts,"[""With Cut Outs Fondant Cutters, it's easy to make fun shapes for your fondant cakes and cupcakes. Just roll out fondant or gum paste, press down with the standard steel Cut outs and lift away.""]",Wilton,B00IE71PNW,"['https://images-na.ssl-images-amazon.com/images/I/41gt0in6x4L._SS40_.jpg', 'https://images-na.ssl-images-amazon.com/images/I/51MWQwZsD9L._SS40_.jpg']",5.0,5.0,"['cut', 'standard', 'fondant', 'cutouts', 'easy', 'fun', 'wilton', 'cutters', 'gum', 'paste', 'shapes', 'steel', 'cakes', 'cupcakes', 'number', 'outs', 'alphabet']"
Presto 06852 16-Inch Electric Skillet with Glass Cover,"['Jumbo size. Big 16-inch cooking surface with high side-walls for extra cooking and serving capacity. Roasts, fries, grills, stews, bakes, makes casseroles and more. Fully immersible with heat control removed for easy cleaning. Tempered glass cover lets you see what is inside. Great for use as a buffet server when entertaining. Heavy cast aluminum.']",Presto,B0007XRTDG,"['https://images-na.ssl-images-amazon.com/images/I/41gVYdS0ocL._SS40_.jpg', 'https://images-na.ssl-images-amazon.com/images/I/51p4WayJi8L._SS40_.jpg', 'https://images-na.ssl-images-amazon.com/images/I/41fuMh-oxcL._SS40_.jpg']",4.9375,16.0,"['grills', 'cover', 'easy', 'cooking', 'entertaining', 'surface', 'heavy', 'cast', 'heat', 'tempered', 'roasts', 'aluminum', 'inside', 'cleaning', 'high', 'immersible', 'skillet', 'presto', 'jumbo', 'great', 'use', 'buffet', 'electric', 'fries', 'big', 'glass', 'control', 'stews', 'extra', 'size', 'walls', 'bakes', 'casseroles', 'capacity', 'server']"
"Anchor Hocking Montana Glass Jar with Fresh Sealed Lid, Brushed Metal, 1.5 Gallon","['A perfect place to store cereals, pastas, flour, sugar, or any of your favorite items! this jar is perfect for registries, new homeowners and holidays. Anchor glass is made in the USA.']",Anchor Hocking,B000RMO41M,"['https://images-na.ssl-images-amazon.com/images/I/51Cf39JjY3L._SS40_.jpg', 'https://images-na.ssl-images-amazon.com/images/I/51BuKA529OL._SS40_.jpg', 'https://images-na.ssl-images-amazon.com/images/I/51CGuuvDfZL._SS40_.jpg', 'https://images-na.ssl-images-amazon.com/images/I/61nS5CovQPL._SS40_.jpg', 'https://images-na.ssl-images-amazon.com/images/I/61mWhafKXgL._SS40_.jpg', 'https://images-na.ssl-images-amazon.com/images/I/61KGmD%2B1ChL._SS40_.jpg']",4.933333333333334,15.0,"['perfect', 'anchor', 'hocking', 'homeowners', 'pastas', 'new', 'metal', 'cereals', 'registries', 'montana', 'fresh', 'lid', 'glass', 'items', 'usa', 'favorite', 'gallon', 'place', 'sugar', 'holidays', 'flour', 'jar']"
"Cozy Fleece -  Alta Luxury Hotel Fleece Blanket,Queen, Ivory","['Brand New Luxury Hotel Fleece Blanket are Anti-Pill, they wash well time and time again, comes in colors tan, blue, silver, ivory. Alta is light weight and warm. Double stitched ends.']",Cozy Fleece,B00CFLFSF4,"['https://images-na.ssl-images-amazon.com/images/I/41qMhwtVOLL._SS40_.jpg', 'https://images-na.ssl-images-amazon.com/images/I/41sf8BLAtuL._SS36_.jpg', 'https://images-na.ssl-images-amazon.com/images/I/41ds6g9LzKL._SS36_.jpg', 'https://images-na.ssl-images-amazon.com/images/I/413AxtaMb0L._SS36_.jpg', 'https://images-na.ssl-images-amazon.com/images/I/41wQ2n%2BhWqL._SS36_.jpg']",4.909090909090909,11.0,"['queen', 'weight', 'tan', 'fleece', 'anti', 'new', 'light', 'alta', 'pill', 'ends', 'blanket', 'time', 'brand', 'silver', 'hotel', 'double', 'cozy', 'blue', 'warm', 'luxury', 'ivory', 'colors']"
Arctic Chill - 3-Piece Stainless Steel Muddling Set - Grooved Nylon Head Muddler - Mixing Spoon with Garnish Fork Tip - Double Cocktail Jigger,"['', 'Make sure every cocktail is bursting with flavor with the Arctic Chill Stainless Steel Jigger, Muddler, and Mixing Spoon/Garnish Fork Set!', 'THE ESSENTIAL BARTENDING SET']",Arctic Chill,B00DDTGV12,"['https://images-na.ssl-images-amazon.com/images/I/31g2HHl7ojL._SS40_.jpg', 'https://images-na.ssl-images-amazon.com/images/I/41bAIMBmwZL._SS40_.jpg', 'https://images-na.ssl-images-amazon.com/images/I/51Wb7%2BBKMML._SS40_.jpg', 'https://images-na.ssl-images-amazon.com/images/I/51NIkx%2BWe9L._SS40_.jpg', 'https://images-na.ssl-images-amazon.com/images/I/51pWUEImP3L._SS40_.jpg', 'https://images-na.ssl-images-amazon.com/images/I/514wBLIv8%2BL._SS40_.jpg']",4.909090909090909,11.0,"['sure', 'spoon', 'cocktail', 'nylon', 'tip', 'fork', 'garnish', 'bartending', 'essential', 'double', 'jigger', 'arctic', 'steel', 'head', 'muddler', 'flavor', 'chill', 'set', 'stainless']"
"Rachael Ray Tools & Gadgets Stainless Steel Bench Scrape, Orange","[""Here's the real inside scoop: the Rachael Ray tools & gadgets stainless steel Bench scrape is one handy and multi-purpose kitchen tool. Constructed from durable, easy-to-clean stainless steel, this convenient gadget makes to easy and even fun pick up and transfer chopped veggies and more from the cutting board directly to the pan or pot. A colorful grippy handle is ribbed so the tool remains a breeze to grasp during use, and it's suitable for both hands. The edge of the scraper is thick enough for safety and thin enough that it can even help to scrape breadcrumbs and diced shallots. And it's perfect for helping to scrape and clean stems, tips and other residual foods from the work surface to the compost bin or trash receptacle. Cleaning the Bench scrape itself is a breeze because it goes right into the dishwasher, and it makes the ideal partner with one of Rach's handy garbage bowls for one solid and dynamic kitchen duo. Grab hold of a kitchen solution to make prepping and cleaning as fun as eating, with the sturdy, easy-cleaning Rachael Ray tools & gadgets stainless steel Bench scrape.""]",Rachael Ray,B001Q6I9TQ,"['https://images-na.ssl-images-amazon.com/images/I/21-x2FxGeML._SS40_.jpg', 'https://images-na.ssl-images-amazon.com/images/I/41H0t2SOSZL._SS40_.jpg', 'https://images-na.ssl-images-amazon.com/images/I/41XgtFY6IkL._SS36_.jpg', 'https://images-na.ssl-images-amazon.com/images/I/310GiYfWosL._SS36_.jpg', 'https://images-na.ssl-images-amazon.com/images/I/31%2BSg%2Bec5YL._SS36_.jpg', 'https://images-na.ssl-images-amazon.com/images/I/41T-CsxUEIL._SS36_.jpg']",4.909090909090909,22.0,"['perfect', 'sturdy', 'easy', 'colorful', 'solution', 'fun', 'real', 'surface', 'ideal', 'rachael', 'scraper', 'handy', 'breadcrumbs', 'hands', 'inside', 'partner', 'compost', 'purpose', 'dynamic', 'thin', 'gadget', 'residual', 'receptacle', 'prepping', 'shallots', 'kitchen', 'grippy', 'scoop', 'work', 'bowls', 'use', 'edge', 'trash', 'cutting', 'scrape', 'foods', 'board', 'pot', 'orange', 'thick', 'multi', 'solid', 'ribbed', 'suitable', 'convenient', 'tips', 'garbage', 'steel', 'safety', 'bench', 'stems', 'hold', 'bin', 'rach', 'breeze', 'dishwasher', 'tools', 'clean', 'handle', 'gadgets', 'pan', 'duo', 'ray', 'tool', 'durable', 'stainless', 'veggies']"
Meal Prep Containers 1 Compartment - Plastic Food Containers for Meal Prepping - Lunch Containers Food Prep Containers - Reusable Food Storage Containers with lids [15 pack],"['MEAL PREP SOCIETY is a company run by meal preppers, for meal preppers. We are dedicated to supporting the growing meal prep community and empowering you to REACH YOUR GOALS.', 'Our MEALPREP containers are perfect for your daily or weekly prepping:', '', '* Microwavable', '* Stackable', '* Freezer safe', '* High-quality plastic (BPA free)', '* Fits in the fridge and your gym bag', '* Reusable', 'Meal prep is a lifestyle that can change your life:', '* Save money', '* Control portions', '* Know exactly how much you eat', '* Track your macros', '* Lose weight', '* Add Muscle', '* Make gains in the gym', '* Become healthier and happier', 'If you are new to meal prep or you are a meal prep pro, you have come to the right place.']",MealPrep,B00TBMW6LO,"['https://images-na.ssl-images-amazon.com/images/I/61yjL4yD7-L._SS40_.jpg', 'https://images-na.ssl-images-amazon.com/images/I/51Xq4VrH3mL._SS40_.jpg', 'https://images-na.ssl-images-amazon.com/images/I/61dP8dQSW8L._SS40_.jpg', 'https://images-na.ssl-images-amazon.com/images/I/51vHkgR-Q5L._SS40_.jpg', 'https://images-na.ssl-images-amazon.com/images/I/61xzJ4rs6HL._SS40_.jpg']",4.909090909090909,11.0,"['perfect', 'stackable', 'society', 'quality', 'muscle', 'weight', 'plastic', 'safe', 'bag', 'happier', 'new', 'compartment', 'high', 'pack', 'free', 'right', 'prepping', 'portions', 'goals', 'freezer', 'gains', 'lids', 'company', 'fits', 'healthier', 'pro', 'fridge', 'control', 'life', 'prep', 'storage', 'food', 'reusable', 'money', 'meal', 'preppers', 'weekly', 'place', 'daily', 'lunch', 'mealprep', 'gym', 'community', 'microwavable', 'dedicated', 'containers', 'macros', 'lifestyle', 'bpa']"
"LORRAINE HOME FASHIONS Whitfield 52-inch by 18-inch Scalloped Valance, Navy",['Deluxe heavy weight tone on tone jacquard tailored panel is woven in an all-over leaf motif using dull and shiny yarns for depth and interest and then further accented with a printed all-over scrolling floral motif. the matching scalloped valance is finished with a self fabric corded edge.'],Lorraine Home Fashions,B00Q53KW04,"['https://images-na.ssl-images-amazon.com/images/I/61kU7MDyQBL._SS36_.jpg', 'https://images-na.ssl-images-amazon.com/images/I/51CWY5F57wL._SS36_.jpg', 'https://images-na.ssl-images-amazon.com/images/I/61va4eqegcL._SS36_.jpg', 'https://images-na.ssl-images-amazon.com/images/I/51bsBy%2BqLSL._SS36_.jpg', 'https://images-na.ssl-images-amazon.com/images/I/51YjfBZwzqL._SS36_.jpg', 'https://images-na.ssl-images-amazon.com/images/I/519u8oI3LcL._SS36_.jpg', 'https://images-na.ssl-images-amazon.com/images/I/51%2B0W7yiBoL._SS36_.jpg', 'https://images-na.ssl-images-amazon.com/images/I/51Xn7I2qKmL._SS36_.jpg', 'https://images-na.ssl-images-amazon.com/images/I/41hNSd5SG9L._SS36_.jpg', 'https://images-na.ssl-images-amazon.com/images/I/51cNsKiccjL._SS36_.jpg']",4.909090909090909,11.0,"['heavy', 'weight', 'jacquard', 'deluxe', 'navy', 'matching', 'motif', 'leaf', 'fashions', 'shiny', 'edge', 'self', 'yarns', 'home', 'panel', 'depth', 'floral', 'interest', 'whitfield', 'dull', 'fabric', 'lorraine', 'tone', 'valance']"
"EatSmart EES1011 Precision Elite Digital Kitchen Scale - 15 lb. Capacity, UltraBright Display and Stainless Steel Platform","['The EatSmart Precision Elite Digital Kitchen Scale is the chef-preferred food scale for everyday use. From weighing food to monitoring caloric intake, the Precision Elite provides exactly what its name states - reliably precise measurements every time. In fact, this cooking scale was designed in conjunction with professional chefs and bakers to represent the elite in kitchen scales on the market today. EatSmart precision sensors are accurate to the nearest 0.5 oz/1 gram, which is ideal for baking. The TARE feature subtracts the weight of a container and allows chefs to weigh multiple items in a row with ease, while the oversized, durable stainless steel platform is ample enough to accommodate large mixing bowls and plates. The Precision Elite provides accurate food weight readings up to 15 lbs./7 kg. in four measurement units - ounces, pounds, grams, and kilograms. The display also features a crystal-white backlight for easy reading in any lighting condition. Manufactured to the highest quality specifications, the Precision Elite provides chefs with the information they need to create consistent, delicious recipes and keep track of their health. In addition to 4 AAA batteries, a free Calorie Factors Booklet is also included to help you master calorie counting and portion control with your scale.']",EatSmart,B009EUPMFK,"['https://images-na.ssl-images-amazon.com/images/I/41GfJKDjJsL._SS40_.jpg', 'https://images-na.ssl-images-amazon.com/images/I/51Tk6P4cKcL._SS40_.jpg', 'https://images-na.ssl-images-amazon.com/images/I/51W6im2WYVL._SS40_.jpg', 'https://images-na.ssl-images-amazon.com/images/I/41pUus-ebAL._SS40_.jpg']",4.9,10.0,"['bakers', 'weight', 'elite', 'tare', 'container', 'ample', 'factors', 'kitchen', 'units', 'kilograms', 'ease', 'large', 'lighting', 'scales', 'caloric', 'booklet', 'white', 'health', 'measurements', 'intake', 'feature', 'precise', 'aaa', 'backlight', 'kg', 'use', 'multiple', 'ultrabright', 'oversized', 'control', 'condition', 'plates', 'steel', 'highest', 'lb', 'measurement', 'states', 'capacity', 'stainless', 'track', 'gram', 'grams', 'easy', 'eatsmart', 'counting', 'display', 'portion', 'delicious', 'market', 'time', 'ees1011', 'lbs./7', 'readings', 'platform', 'accurate', 'information', 'items', 'reading', 'food', 'row', 'digital', 'recipes', 'scale', 'fact', 'batteries', 'ounces', 'chef', 'ideal', 'cooking', 'quality', 'baking', 'free', 'sensors', 'professional', 'precision', 'bowls', 'chefs', 'nearest', 'everyday', 'crystal', 'conjunction', 'specifications', 'addition', 'today', 'pounds', 'consistent', 'durable', 'calorie']"
Whitmor 2 Tier Stackable Closet Shelves  - Chrome,"['Whitmor\'s Stackable Closet Shelves, help to organize closet areas. These shelves are made of durable chromed steel and offer a simple no-tool assembly. Each unit features two shelves for storing shoes, sweaters, accessories and books, making use of empty space against the wall. These shelves are 12"" deep and two or more units can be easily stacked together. This product is very sturdy, heavy weight and easy to clean under, while the chrome provides a classy, finished look. The Whitmor Stackable Closet shelves are practical and function well, assisting you in maximizing your closet space. You are sure to be pleased with this versatile product which will be ideal for arranging your items in an orderly fashion to make them visible and accessible.Whitmor is a 4th generation family-owned and operated business. Since 1946, Whitmor has been dedicated to bringing organization home by creating products that simplify everyday life. Ensuring that those products are built with integrity, value, and innovation is our commitment to you. And our promise is that we will always be here for you should you ever need us as we stand behind our product 100%. Whitmor customer service is available in English and Spanish Monday through Friday from 8am - 4:30pm CST. Call us and we will gladly assist you in your language. You may contact Whitmor toll-free at 1-888-944-8667 or via email at customer_service@whitmor.com.', 'By']",Whitmor,B0017L6CB2,"['https://images-na.ssl-images-amazon.com/images/I/41UYHNNt5KL._SS40_.jpg', 'https://images-na.ssl-images-amazon.com/images/I/41az%2BIS9DzL._SS40_.jpg']",4.9,10.0,"['sure', 'sturdy', 'easy', 'email', 'stackable', 'customer_service@whitmor.com', 'generation', 'shoes', 'heavy', 'available', 'weight', 'versatile', 'classy', 'family', 'service', 'pleased', 'products', 'chrome', 'books', 'whitmor', 'commitment', 'cst', 'free', 'language', 'integrity', 'promise', 'innovation', 'units', 'orderly', 'assembly', 'use', 'wall', 'value', 'business', 'friday', 'shelves', 'fashion', 'organization', 'monday', 'space', 'areas', 'items', 'everyday', 'deep', 'life', 'sweaters', 'look', '4th', 'steel', 'chromed', 'toll', 'product', 'practical', 'tier', 'accessible.whitmor', 'visible', 'english', 'unit', 'simple', 'closet', 'accessories', 'customer', 'tool', 'durable', 'ideal', 'spanish']"
CRESNEL Non-Slip Velvet Clothes Hanger - Set of 50 - Heavy Duty - Beige,"['Cresnel (TM) clothes hanger is made of durable material to provide long lasting use. The non-slip velvet surface coupled with notched shoulder will help keep clothes in position easily. Extra built-in holder allows hanging of tie, scarf or any small garment item. With this smart Cresnel hanger you can now pre-select a set of coat, pant and tie all in one single hanger. High quality assurance with 30 days money back satisfaction guarantee.']",CRESNEL,B01DLKO9TI,"['https://images-na.ssl-images-amazon.com/images/I/41Ypu99CQuL._SS40_.jpg', 'https://images-na.ssl-images-amazon.com/images/I/51gC-Ytp7bL._SS36_.jpg', 'https://images-na.ssl-images-amazon.com/images/I/41SMZ266k6L._SS36_.jpg']",4.9,10.0,"['small', 'guarantee', 'notched', 'tie', 'garment', 'coat', 'smart', 'surface', 'heavy', 'cresnel', 'lasting', 'slip', 'beige', 'quality', 'position', 'satisfaction', 'holder', 'days', 'high', 'item', 'non', 'long', 'use', 'tm', 'pant', 'duty', 'single', 'scarf', 'velvet', 'clothes', 'money', 'assurance', 'shoulder', 'set', 'material', 'durable', 'hanger']"
