title,description,brand,asin,image,rating,nReviews,keywords
"Springform Pan, MCIRCO 9 Inches Nonstick Leakproof Springfrom Pan Heart Shape Bakeware Cake Pan Mold Baking Tools with Removable Smooth Bottom and Quick-Release Latch","[""About us MCIRCO is a professional Home& Kitchen product supplier.We focus on supplying all kinds of quality, stylish and attractive items to help improve customers' high quality life.We devote ourselves to improving customers' on-line shopping experience.Product highlights MCIRCO professional bakeware is a wonderful addition to any kitchen. Made of a strong, durable, substantial material, BPA free, nontoxic black and red nonstick coating, very safe to use. Well designed for easy-release and effortless clean up, evenly baking makes your cakes and cheesecakes more delicious.Cleaning NoticePlease hand wash only after your use. Choose soft tools and mild detergent when you clean it to protect non-stick coating. Avoid sharp and rough tools to scratch the pan.AttentionAs the springform pan is bigger than normal . Before baking ,make sure it is completely sealed.Meanwhile,flour can not be too thin.Warranty We provide a 6-month warranty for every purchase from MCIRCO. If you need any helpJust please Contact Seller directly from Amazon Buyer Center against your order #.We will take care of you within 24 hours.""]",Mcirco,B0193546HK,"['https://images-na.ssl-images-amazon.com/images/I/41LbKF6b3lL._SS40_.jpg', 'https://images-na.ssl-images-amazon.com/images/I/41gMvR4yviL._SS40_.jpg', 'https://images-na.ssl-images-amazon.com/images/I/41Qybq3%2BWFL._SS40_.jpg', 'https://images-na.ssl-images-amazon.com/images/I/51LsptQzL%2BL._SS40_.jpg']",5.0,7.0,"['helpjust', 'noticeplease', 'sharp', 'springfrom', 'substantial', 'kitchen', 'kinds', 'line', 'bakeware', 'hours', 'strong', 'quick', 'attractive', 'shape', 'coating', 'mild', 'flour', 'black', 'amazon', 'mcirco', 'rough', 'use', 'stylish', 'inches', 'cheesecakes', 'red', '6-month', 'product', 'seller', 'cake', 'sure', 'easy', 'safe', 'purchase', 'sealed.meanwhile', 'warranty', 'pan.attentionas', 'cakes', 'thin.warranty', 'supplier.we', 'leakproof', 'items', 'care', 'smooth', 'order', 'soft', 'hand', 'heart', 'quality', 'bigger', 'contact', 'release', 'baking', 'removable', 'high', 'free', 'latch', 'professional', 'normal', 'center', 'nontoxic', 'stick', 'non', 'nonstick', 'springform', 'mold', 'home', 'effortless', 'buyer', 'customers', 'detergent', 'wonderful', 'addition', 'tools', 'life.we', 'clean', 'pan', 'material', 'durable', 'bpa']"
"KitchenAid KSM500PSER Pro 500 Series 10-Speed 5-Quart Stand Mixer, Empire Red","[""KitchenAid's Professional 500 Stand Mixer is a substantial piece of equipment. The High Performance 325 watt motor delivers enough power to handle the heaviest mixtures, and mix large batches easily. It's body features durable, die-cast metal construction, and offers a direct-drive transmission with all metal gears. The sturdy lifting mechanism uses a metal arm and steel lever to effortlessly raise an ingredient filled 5 quart bowl. Ten speeds allow for everything from whipping egg whites to slow churning bread dough and the Soft-Start feature keeps power in check to prevent splashing and flour clouds. A unique mixing action spins the beater clockwise while the shift spins counter clockwise; this results in an even blend. As a safety measure, the motor stops in the event of an obstruction or overloading. The Professional 500 Stand Mixer includes a 5 Quart Stainless Steel bowl, Burnished flat beater, burnished dough hook, and wire whip to achieve all of your culinary tasks.""]",KitchenAid,B0015679I4,"['https://images-na.ssl-images-amazon.com/images/I/41zgAwDtwCL._SS40_.jpg', 'https://images-na.ssl-images-amazon.com/images/I/51GMtEOuFeL._SS40_.jpg', 'https://images-na.ssl-images-amazon.com/images/I/41bqPypmSBL._SS36_.jpg', 'https://images-na.ssl-images-amazon.com/images/I/415EnZAz9RL._SS36_.jpg', 'https://images-na.ssl-images-amazon.com/images/I/41FDa1N19VL._SS36_.jpg', 'https://images-na.ssl-images-amazon.com/images/I/41cRoXaTLBL._SS36_.jpg', 'https://images-na.ssl-images-amazon.com/images/I/51SFvuoDxeL._SS36_.jpg', 'https://images-na.ssl-images-amazon.com/images/I/41CrhwM%2BP9L._SS36_.jpg']",5.0,5.0,"['quart', 'sturdy', 'start', 'feature', 'mixer', 'series', 'ksm500pser', 'clouds', 'body', 'ingredient', 'spins', 'counter', 'arm', 'check', 'metal', 'beater', 'watt', 'high', 'lifting', 'heaviest', 'speeds', 'piece', 'performance', 'substantial', 'batches', 'unique', 'professional', 'mechanism', 'direct', 'whites', 'measure', 'wire', 'stand', 'culinary', 'splashing', 'bread', 'transmission', 'action', 'tasks', 'pro', 'event', 'overloading', 'bowl', 'mixtures', 'large', 'motor', 'shift', 'equipment', 'red', 'steel', 'blend', 'safety', 'whip', 'soft', 'obstruction', 'egg', 'hook', 'drive', 'lever', 'kitchenaid', 'dough', 'gears', 'empire', 'construction', 'power', 'durable', 'stainless', 'flour', 'flat']"
"Willow Tree hand-painted sculpted angel, Courage (26149)","['TITLE: Courage SENTIMENT: Bringing a triumphant spirit, inspiration and courage GIFT-GIVING SUGGESTIONS: A gift to comfort and encourage hope and healing. Willow Tree angels resonate with many cultures and ages of people. To some they represent protection, to some they are an outward reminder of inner peace, and to some they represent a way to remember those who have left this earth. Hand-carved figures reveal their expression through body gestures only... a tilt of the head, placement of the hands, a turn of the body. Since 1999, American artist Susan Lordi has worked in partnership with DEMDACO to produce, market and distribute Willow Tree , her line of carved figurative sculpture. From her studio in Kansas City, Lordi hand carves the original of each figure. This piece is cast from Lordi\'s original and painted by hand. Enclosed inside each fitted packaging box is a gift-giving card with piece title and sentiment on it. Each piece is intended to be open to interpretation from the viewer. ""Willow Tree isn\'t so much about the tangible piece. It represents an emotion or it marks a memory."" -Susan Lordi Ready to display on a shelf, table or mantel. To clean, dust with soft brush or cloth. Avoid water or cleaning solvents.']",Willow Tree,B00133IS8O,"['https://images-na.ssl-images-amazon.com/images/I/412XLuxFo3L._SS40_.jpg', 'https://images-na.ssl-images-amazon.com/images/I/41tqehEmHQL._SS40_.jpg']",5.0,6.0,"['hand', 'turn', 'willow', 'original', 'interpretation', 'gestures', 'artist', 'expression', 'earth', 'peace', 'body', 'water', 'figures', 'hope', 'suggestions', 'lordi', 'healing', 'title', 'hands', 'courage', 'gift', 'reminder', 'dust', 'viewer', 'angels', 'mantel', 'angel', 'sentiment', 'way', 'studio', 'kansas', 'piece', 'inspiration', 'box', '-susan', 'shelf', 'market', 'memory', 'card', 'brush', 'ages', 'spirit', 'tree', 'open', 'emotion', 'city', 'placement', 'line', 'packaging', 'people', 'susan', 'protection', 'sculpture', 'solvents', 'head', 'tilt', 'soft', 'figurative', 'cloth', 'outward', 'inner', 'cultures', 'partnership', 'triumphant', 'figure', 'tangible', 'table', 'american', 'ready', 'demdaco']"
"Willow Tree hand-painted sculpted figure, Grandmother","['TITLE: Grandmother SENTIMENT: A unique love that transcends the years GIFT-GIVING SUGGESTIONS: A gift to celebrate new beginnings, new babies, new families and the loving relationships that develop between parent and child, grandparent and child This piece works well with other figures to create a Family Grouping. Willow Tree is a reminder of someone we want to keep close, or a memory we want to touch. Hand-carved figures reveal their expression through body gestures only... a tilt of the head, placement of the hands, a turn of the body. Since 1999, American artist Susan Lordi has worked in partnership with DEMDACO to produce, market and distribute Willow Tree , her line of carved figurative sculpture. From her studio in Kansas City, Lordi hand carves the original of each figure. This piece is cast from Lordi\'s original and painted by hand. Enclosed inside each fitted packaging box is a gift-giving card with piece title and sentiment on it. Each piece is intended to be open to interpretation from the viewer. ""Willow Tree isn\'t so much about the tangible piece. It represents an emotion or it marks a memory."" -Susan Lordi Ready to display on a shelf, table or mantel. To clean, dust with soft brush or cloth. Avoid water or cleaning solvents.']",Willow Tree,B000XTFZNA,"['https://images-na.ssl-images-amazon.com/images/I/41f8mmLdMoL._SS40_.jpg', 'https://images-na.ssl-images-amazon.com/images/I/41MdHkgvuRL._SS40_.jpg', 'https://images-na.ssl-images-amazon.com/images/I/31y23E6v-KL._SS40_.jpg']",5.0,8.0,"['hand', 'turn', 'willow', 'grandparent', 'original', 'interpretation', 'relationships', 'gestures', 'artist', 'expression', 'water', 'body', 'years', 'figures', 'family', 'child', 'suggestions', 'lordi', 'title', 'hands', 'new', 'gift', 'families', 'reminder', 'viewer', 'dust', 'mantel', 'shelf', 'sentiment', 'unique', 'babies', 'piece', 'parent', 'studio', 'kansas', 'box', '-susan', 'memory', 'market', 'card', 'brush', 'tree', 'open', 'emotion', 'love', 'city', 'grouping', 'placement', 'line', 'packaging', 'beginnings', 'susan', 'sculpture', 'solvents', 'head', 'tilt', 'soft', 'grandmother', 'close', 'figurative', 'cloth', 'partnership', 'tangible', 'figure', 'table', 'american', 'ready', 'demdaco']"
Lenox Butterfly Meadow 60-inch by 102-inch Oblong / Rectangle Tablecloth,"['7255 BUTTERFLY MEADOW 102/OBL MLT Size: 102"" W x 60"" D Features: -54 pct Cotton and 46pct polyester material.-Machine wash in cold, tumble dry without heat.-Press with a warm iron if needed.-Oblong or rectangle shape. Color/Finish: -Classic floral print on white ground with butterfly accents and subtle underlying leaf pattern. Dimensions: -52\'\' W x 52\'\' D, 1.5 lbs.-70\'\' W x 52\'\' D, 1.5 lbs.-84\'\' W x 60\'\' D, 1.5 lbs.-102\'\' W x 60\'\' D, 1.5 lbs.-120\'\' W x 60\'\' D, 1.5 lbs. Collection: -Butterfly Meadow collection.']",Lenox,B000U61A76,['https://images-na.ssl-images-amazon.com/images/I/510FojZRqbL._SS40_.jpg'],5.0,5.0,"['mlt', 'needed.-oblong', 'underlying', 'd', 'cotton', 'lbs.-120', 'pct', 'tumble', 'meadow', '-54', 'obl', 'butterfly', 'features', 'ground', 'dimensions', 'leaf', 'w', 'rectangle', 'pattern', 'collection', 'material.-machine', 'lbs.-84', 'finish', 'color', 'lbs.-102', 'lenox', 'polyester', 'floral', 'accents', 'warm', 'size', 'iron', 'x', 'print', 'oblong', 'heat.-press', 'subtle', 'lbs.-70', 'shape', 'white', '-52', 'lbs', 'tablecloth', 'cold']"
"T-fal A80789 Specialty Nonstick Dishwasher Safe Oven Safe PFOA-Free Jumbo Wok Cookware, 14-Inch, Black","['Prepare delicious Asian-inspired meals for the whole family with this T-fal Specialty nonstick 14-inch jumbo wok. Made of durable aluminum and traditionally shaped with a wide top and narrow base, the gently curved wok heats quickly and evenly, sealing in flavor. The woks PFOA-free nonstick (inside and out) requires the use of little to no oil or fat for healthier cooking, effortless food release, and quick, convenient cleanup. Ideal for stir-frying, the versatile wok also works well for steaming, searing, sauteing, pan or deep frying, poaching, boiling, braising, making soup, or even roasting nuts. The woks long, stay-cool handle promotes a secure grip, keeps hands a safe distance from the heat, and comes with a hole at the end for optional hanging storage. Oven safe up to 350 degrees F and dishwasher-safe, the T-fal Specialty nonstick 14-inch jumbo wok makes a great gift idea for anyone looking for fresh inspiration when it comes to healthy, great-tasting, home-cooked meals.']",T-fal,B000MYI2ZO,"['https://images-na.ssl-images-amazon.com/images/I/51PqDgomUJL._SS40_.jpg', 'https://images-na.ssl-images-amazon.com/images/I/512K291oSDL._SS40_.jpg', 'https://images-na.ssl-images-amazon.com/images/I/41%2ByXEONjlL._SS40_.jpg', 'https://images-na.ssl-images-amazon.com/images/I/51tP0ilQfxL._SS40_.jpg']",5.0,12.0,"['black', 'cooking', 'oven', 'distance', 'secure', 'hole', 'versatile', 'hanging', 'family', 'safe', 'heat', 'release', 'aluminum', 'hands', 'little', 'stir', 'optional', 'gift', 'cookware', 'free', 'wide', 'fat', 'a80789', 'delicious', 'searing', 'braising', 'inspiration', 'fal', 'base', 'jumbo', 'great', 'fresh', 'use', 'nonstick', 'healthier', 'home', 'effortless', 'soup', 'idea', 'healthy', 'nuts', 'deep', 'meals', 'convenient', 'oil', 'poaching', 'curved', 'food', 'end', 'storage', 'wok', 'quick', 'cleanup', 'flavor', 'grip', 'degrees', 'f', 'specialty', 'pfoa', 'dishwasher', 'handle', 'cool', 't', 'asian', 'narrow', 'boiling', 'durable', 'ideal', 'woks', 'frying']"
"INNOCLOCK - Most Advanced Calendar Day Digital Clock - Large, Clear, Unabbreviated Time and Date - Ideal for Memory Loss, Impaired Vision and Seniors (Black, 8-inch)","['The INNOCLOCK by Timeless is a state-of-the-art clock featuring a large, clear display that can be hung on a wall (using its rear mount hole), or stood on a table, nightstand, shelf or desk (using its pull-out stand). Its great for the home, office, lab and classroom, and especially for seniors and those who benefit from seeing the time and date spelled out and free from abbreviations. Incredibly easy to set up and use. Includes five built-in languages - English, Spanish, French, German and Italian. Powered by included AC adapter (100-250V) with approx 6 (1.8m) long cable. Give the gift of confidence and happiness  buy an INNOCLOCK for your loved ones today!']",Timeless,B01A38Z9M2,"['https://images-na.ssl-images-amazon.com/images/I/51LYZ0IQqKL._SS40_.jpg', 'https://images-na.ssl-images-amazon.com/images/I/51OBIE43p-L._SS40_.jpg', 'https://images-na.ssl-images-amazon.com/images/I/41-KTp2ifQL._SS40_.jpg', 'https://images-na.ssl-images-amazon.com/images/I/51otV0GDVZL._SS40_.jpg', 'https://images-na.ssl-images-amazon.com/images/I/51%2BT46C0L7L._SS40_.jpg', 'https://images-na.ssl-images-amazon.com/images/I/416f5FZTreL._SS40_.jpg']",5.0,5.0,"['black', 'easy', 'loss', 'hole', 'abbreviations', 'adapter', 'ones', 'impaired', 'display', 'state', 'seniors', 'spanish', 'happiness', 'cable', 'gift', 'unabbreviated', 'mount', 'free', 'shelf', 'clock', 'memory', 'timeless', 'day', 'classroom', 'time', 'm', 'great', 'long', 'vision', '250v', 'wall', 'french', 'german', 'rear', 'nightstand', 'home', 'languages', 'clear', 'confidence', 'large', 'calendar', 'desk', 'date', 'innoclock', 'advanced', 'digital', 'office', 'english', 'italian', 'today', 'ac', 'approx', 'stand', 'table', 'art', 'ideal', 'lab']"
10015 Blue 7'10x10'6 Area Rug Carpet Large,"[""Our 10015 oriental rug selection of elegant, exquisite, beautifully modern rugs to add the perfect finishing touch to your living room, dining room, bedroom or any other area in your home. Affordable and refined, our finely crafted area rugs span a wide array of sizes, shapes, materials, color schemes and designs. Take your pick from a vast assortment of chic, abstract rugs that will pull any room together, and save a bundle while doing so. As you'll quickly see, our modern rugs couldn't be lovelier--or more competitively priced, Shopping for area rugs is a lot more enjoyable when you know you'll be getting the very best. You will get that and much more by selecting a stunning, modern rug from our incredible collection. At long last, you don't have to spend a small fortune to own a beautiful rug that adds genuine elegance and style to your home, and you can rest assured that any rug that you purchase from us is of the finest quality.""]",Persian Area Rugs,B01A9DZK2K,"['https://images-na.ssl-images-amazon.com/images/I/51GneWYwESL._SS40_.jpg', 'https://images-na.ssl-images-amazon.com/images/I/51Xw9TN4vTL._SS40_.jpg', 'https://images-na.ssl-images-amazon.com/images/I/61mfSfb63qL._SS40_.jpg', 'https://images-na.ssl-images-amazon.com/images/I/61HmEVQo28L._SS40_.jpg', 'https://images-na.ssl-images-amazon.com/images/I/619QqrsA0GL._SS40_.jpg', 'https://images-na.ssl-images-amazon.com/images/I/61sAYzTZ0dL._SS36_.jpg', 'https://images-na.ssl-images-amazon.com/images/I/61sAObOd3dL._SS36_.jpg', 'https://images-na.ssl-images-amazon.com/images/I/61sAObOd3dL._SS36_.jpg']",5.0,5.0,"['small', 'perfect', 'abstract', 'pick', 'finest', 'sizes', 'materials', 'quality', 'shapes', 'lovelier', 'array', 'best', 'refined', 'oriental', 'vast', 'modern', 'touch', 'wide', 'elegant', 'chic', 'dining', 'lot', 'area', 'rugs', 'assortment', 'incredible', 'schemes', 'selection', 'collection', 'beautiful', 'home', ""7'10x10'6"", 'color', 'fortune', 'enjoyable', 'bedroom', 'bundle', 'living', 'stunning', 'designs', 'genuine', 'blue', 'elegance', 'affordable', 'carpet', 'room', 'rug', 'style', 'exquisite']"
YETI Rambler 30 oz Stainless Steel Vacuum Insulated Tumbler with Lid,"['', 'Rambler 30 oz. Tumbler with Lid', 'Days on the dock are made better with the Rambler 30 oz. Tumbler. Itll keep your dinnertime drink cool well past sundown or your coffee nice and hot throughout the morning. The Rambler 30 oz. Tumbler is made of 18/8 kitchen-grade stainless steel, has double-wall vacuum insulation, and No Sweat Design. Which means that youve got one heavy-duty, over-engineered tumbler on your hands with the Rambler. Its dishwasher safe, BPA-free, and ready for just about anything.', 'The YETI 30 oz Rambler Tumbler stands 7 5/8 in high and has a lip diameter of 4 in. All YETI Tumblers are sized to fit in standard sized cup holders.']",YETI,B01B13YLPY,"['https://images-na.ssl-images-amazon.com/images/I/51BIq-%2B0hJL._SS40_.jpg', 'https://images-na.ssl-images-amazon.com/images/I/41VQ5fFGb8L._SS40_.jpg', 'https://images-na.ssl-images-amazon.com/images/I/31Jzwnsic9L._SS40_.jpg', 'https://images-na.ssl-images-amazon.com/images/I/510PIfY%2BsML._SS40_.jpg', 'https://images-na.ssl-images-amazon.com/images/I/51I1buf17uL._SS40_.jpg', 'https://images-na.ssl-images-amazon.com/images/I/51g2sBHFfTL._SS40_.jpg']",5.0,8.0,"['hot', 'rambler', 'heavy', 'insulation', 'holders', '18/8', 'safe', 'days', 'hands', 'dinnertime', 'yeti', 'high', 'free', 'coffee', 'kitchen', 'diameter', 'morning', 'better', 'dock', 'design', 'wall', 'bpa', 'standard', 'double', 'oz', 'lid', 'cup', 'duty', 'sweat', 'past', 'steel', 'sized', 'tumbler', 'lip', 'sundown', 'vacuum', 'dishwasher', 'nice', 'cool', 'grade', 'tumblers', 'ready', 'stainless']"
"10"" Stainless Steel Cocktail Muddler and Mixing Spoon with Cocktail Recipes eBook, Muddler Bar Tool Set","['', 'Want to make the perfect cocktail?', 'You have an amazing recipe and fresh ingredients. Now all you need are the perfect tools! With the Cresimo Muddler and Stirrer set you can make the perfect cocktails for you and your friends. The muddler is ideal for mashing fruits, herbs and spices to perfectly blend the flavor into your drink.', 'Easy to use and clean!', 'Designed to rest easily in your hand and with ten inches of length, the Cresimo muddler reaches deep into the glass to easily muddle your ingredients. Unlike many muddlers that are made of wood and covered in lacquer, our stainless steel muddler bar tool set and cocktail spoon is hygienic and easy to clean.', 'Perfect Gift Set!', 'Our high quality muddler and cocktail stirrer comes with a digital instruction and cocktail guide making it the ideal gift set for any cocktail enthusiast.', 'Worry free shopping!', 'With our 100% no questions asked two year guarantee, if you are not completely satisfied we will refund your full purchase price.', 'Key Features and Benefits', 'Easy to clean stainless muddler  BPA free hygienic grooved nylon head  Stainless steel stirrer  Digital instruction and cocktail guide  100% Money Back Guarantee', 'While this set is dishwasher safe hand cleaning is recommended']",Cresimo,B01AJXGJGQ,"['https://images-na.ssl-images-amazon.com/images/I/31GgkNrCunL._SS40_.jpg', 'https://images-na.ssl-images-amazon.com/images/I/51FLaWsXdKL._SS40_.jpg', 'https://images-na.ssl-images-amazon.com/images/I/51zNQjTr-NL._SS40_.jpg', 'https://images-na.ssl-images-amazon.com/images/I/4133X6DWw0L._SS40_.jpg', 'https://images-na.ssl-images-amazon.com/images/I/41G2eLLsMqL._SS40_.jpg', 'https://images-na.ssl-images-amazon.com/images/I/31%2BinR-Ir3L._SS40_.jpg']",5.0,11.0,"['bar', 'perfect', 'hand', 'easy', 'spoon', 'friends', 'enthusiast', 'guarantee', 'ideal', 'wood', 'ingredients', 'cocktail', 'quality', 'guide', 'questions', 'fruits', 'safe', 'shopping', 'nylon', 'purchase', 'cleaning', 'gift', 'high', 'lacquer', 'features', 'free', 'grooved', 'drink', 'fresh', 'length', 'price', 'benefits', 'bpa', 'hygienic', 'spices', 'recipe', 'inches', 'stirrer', 'glass', 'muddlers', 'herbs', 'amazing', 'steel', 'satisfied', 'key', 'money', 'head', 'instruction', 'cocktails', 'year', 'muddler', 'flavor', 'digital', 'cresimo', 'set', 'recipes', 'tools', 'clean', 'dishwasher', 'ebook', 'tool', 'stainless']"
"Brewooze 3x Smart Refillable cups - Compatible with Keurig Brewers 2.0 | K300,K350,K400,K450,K500,K550 Series and 1.0 brewers - Fits Perfectly Inside Keurig,Cuisinart,Breville and Mr Coffee Machines","['We put delicious, gourmet coffee at your fingertips again and again with reusable cups. Its no secret that people all over the world love coffee.  We have coffee shops on every corner and coffee makers in most every home in the land.Thats why Brewoozehas created the Smart Reusable cup . With the Brewooze Smart Reusable Cups, you can create the freshest, most delicious coffee, without the expense of buying boxes of cups that are just a one-time use. Choose from your favorite ground coffee, tea leaves or cocoa selections, and reuse our cups over time to keep money in your pocket and garbage out of a landfill. Check out this bargain:     3x Color smart cups  1x Water charcoal filter for water purification   Instruction Manual   All this for $12.97! Here are a few additional features:  100% BPA Free  Three piece set  Dynamic water flow ensures smooth brewing  Micromesh stainless steel filter minimizes sediment  Silicone O-Ring ensures a tight, leak-proof seal  Easy to clean and reusable  Fits most any 1.0 or 2.0 brewer  Compatible with Keurig, Cuisinart, Beville, Mr. Coffee and more.  GET YOURS TODAY BY CLICKING ADD TO CART ABOVE']",Brewooze,B00VSS6UV6,"['https://images-na.ssl-images-amazon.com/images/I/51M7Fk9TpjL._SS40_.jpg', 'https://images-na.ssl-images-amazon.com/images/I/51t2%2BLegqjL._SS40_.jpg', 'https://images-na.ssl-images-amazon.com/images/I/61KEz2aCl6L._SS40_.jpg', 'https://images-na.ssl-images-amazon.com/images/I/51rRCDHJM1L._SS40_.jpg', 'https://images-na.ssl-images-amazon.com/images/I/51ga0f89J2L._SS40_.jpg']",5.0,6.0,"['landfill', 'manual', 'pocket', 'brewoozehas', 'series', 'charcoal', 'smart', 'k300,k350,k400,k450,k500,k550', 'water', 'filter', 'micromesh', 'sediment', 'cuisinart', 'leak', 'seal', 'brewing', 'shops', '1x', 'stainless', 'silicone', 'breville', 'tight', 'compatible', 'brewer', 'cocoa', 'purification', 'dynamic', 'ring', 'gourmet', 'features', 'free', 'coffee', 'delicious', 'boxes', 'ground', 'freshest', 'piece', 'mr', 'brewers', 'proof', 'beville', 'brewooze', 'bargain', 'time', 'use', 'love', 'fingertips', 'corner', 'makers', 'keurig', 'leaves', 'selections', 'home', 'expense', 'refillable', 'secret', 'cup', 'people', 'color', '3x', 'world', 'favorite', 'o', 'steel', 'reusable', 'money', 'land.thats', 'smooth', 'instruction', 'flow', 'today', 'cups', 'machines', 'additional', 'tea', 'bpa']"
"STEELMASTER Deluxe Steel 9 Inch Bookends, 1 Pair, Cobalt Blue (241009108)","['The STEELMASTER focuses on small office and home organization products. Products are designed to appeal to consumers at home or at work. The cobalt blue can be seamlessly incorporated into kitchens or offices to organize yourself, and your family, with style. STEELMASTER Deluxe Steel Bookends have a reinforced rib design for added strength and stability. Perfect for housing binders, magazines, or cookbooks the Steel Bookends are constructed of heavy-gauge steel to provide maximum strength and stability. STEELMASTER 9 inch Steel Bookends are coated with a scratch and chip-resistant powder finish and have a non-mar padded bottom; the blue color adds a splash of color to any home or office decor.']",STEELMASTER,B005M0MOMU,"['https://images-na.ssl-images-amazon.com/images/I/61euikIxd9L._SS40_.jpg', 'https://images-na.ssl-images-amazon.com/images/I/51ReOmHXsyL._SS40_.jpg', 'https://images-na.ssl-images-amazon.com/images/I/4162oWIVqJL._SS36_.jpg', 'https://images-na.ssl-images-amazon.com/images/I/416zMCREFkL._SS36_.jpg']",5.0,6.0,"['small', 'rib', 'perfect', 'chip', 'heavy', 'powder', 'gauge', 'scratch', 'family', 'products', 'binders', 'bookends', 'deluxe', 'splash', 'steelmaster', 'maximum', 'pair', 'work', 'non', 'padded', 'design', 'finish', 'home', 'color', 'organization', 'cobalt', 'cookbooks', 'kitchens', 'steel', 'decor', 'inch', 'blue', 'strength', 'housing', 'office', 'consumers', 'style', 'resistant', 'magazines', 'offices', 'mar', 'stability']"
