title,description,brand,asin,image,rating,nReviews,keywords
"LORRAINE HOME FASHIONS Whitfield 52-inch by 18-inch Scalloped Valance, Navy",['Deluxe heavy weight tone on tone jacquard tailored panel is woven in an all-over leaf motif using dull and shiny yarns for depth and interest and then further accented with a printed all-over scrolling floral motif. the matching scalloped valance is finished with a self fabric corded edge.'],Lorraine Home Fashions,B00Q53KW04,https://images-na.ssl-images-amazon.com/images/I/91drfQqObnL._AC_SY450_.jpg,4.909090909090909,11.0,"['edge', 'navy', 'leaf', 'heavy', 'matching', 'lorraine', 'floral', 'whitfield', 'weight', 'self', 'deluxe', 'panel', 'home', 'motif', 'shiny', 'dull', 'interest', 'yarns', 'fabric', 'fashions', 'valance', 'jacquard', 'tone', 'depth']"
"EatSmart EES1011 Precision Elite Digital Kitchen Scale - 15 lb. Capacity, UltraBright Display and Stainless Steel Platform","['The EatSmart Precision Elite Digital Kitchen Scale is the chef-preferred food scale for everyday use. From weighing food to monitoring caloric intake, the Precision Elite provides exactly what its name states - reliably precise measurements every time. In fact, this cooking scale was designed in conjunction with professional chefs and bakers to represent the elite in kitchen scales on the market today. EatSmart precision sensors are accurate to the nearest 0.5 oz/1 gram, which is ideal for baking. The TARE feature subtracts the weight of a container and allows chefs to weigh multiple items in a row with ease, while the oversized, durable stainless steel platform is ample enough to accommodate large mixing bowls and plates. The Precision Elite provides accurate food weight readings up to 15 lbs./7 kg. in four measurement units - ounces, pounds, grams, and kilograms. The display also features a crystal-white backlight for easy reading in any lighting condition. Manufactured to the highest quality specifications, the Precision Elite provides chefs with the information they need to create consistent, delicious recipes and keep track of their health. In addition to 4 AAA batteries, a free Calorie Factors Booklet is also included to help you master calorie counting and portion control with your scale.']",EatSmart,B009EUPMFK,https://images-na.ssl-images-amazon.com/images/I/711oh9Y5VyL._AC_SY450_.jpg,4.9,10.0,"['precise', 'ample', 'recipes', 'easy', 'use', 'units', 'readings', 'states', 'chef', 'elite', 'tare', 'plates', 'feature', 'platform', 'lighting', 'food', 'ees1011', 'information', 'precision', 'batteries', 'ultrabright', 'calorie', 'items', 'health', 'specifications', 'capacity', 'crystal', 'oversized', 'track', 'measurements', 'baking', 'durable', 'lb', 'eatsmart', 'lbs./7', 'everyday', 'professional', 'reading', 'condition', 'conjunction', 'display', 'control', 'white', 'pounds', 'bowls', 'ideal', 'scales', 'caloric', 'ounces', 'kilograms', 'aaa', 'large', 'cooking', 'digital', 'sensors', 'portion', 'nearest', 'counting', 'intake', 'consistent', 'steel', 'quality', 'measurement', 'grams', 'kg', 'row', 'time', 'market', 'gram', 'multiple', 'weight', 'accurate', 'container', 'free', 'kitchen', 'today', 'booklet', 'delicious', 'chefs', 'addition', 'scale', 'bakers', 'stainless', 'backlight', 'fact', 'highest', 'factors', 'ease']"
Whitmor 2 Tier Stackable Closet Shelves  - Chrome,"['Whitmor\'s Stackable Closet Shelves, help to organize closet areas. These shelves are made of durable chromed steel and offer a simple no-tool assembly. Each unit features two shelves for storing shoes, sweaters, accessories and books, making use of empty space against the wall. These shelves are 12"" deep and two or more units can be easily stacked together. This product is very sturdy, heavy weight and easy to clean under, while the chrome provides a classy, finished look. The Whitmor Stackable Closet shelves are practical and function well, assisting you in maximizing your closet space. You are sure to be pleased with this versatile product which will be ideal for arranging your items in an orderly fashion to make them visible and accessible.Whitmor is a 4th generation family-owned and operated business. Since 1946, Whitmor has been dedicated to bringing organization home by creating products that simplify everyday life. Ensuring that those products are built with integrity, value, and innovation is our commitment to you. And our promise is that we will always be here for you should you ever need us as we stand behind our product 100%. Whitmor customer service is available in English and Spanish Monday through Friday from 8am - 4:30pm CST. Call us and we will gladly assist you in your language. You may contact Whitmor toll-free at 1-888-944-8667 or via email at customer_service@whitmor.com.', 'By']",Whitmor,B0017L6CB2,https://images-na.ssl-images-amazon.com/images/I/81L2NXaClaL._AC_SX569_.jpg,4.9,10.0,"['sturdy', 'ideal', 'look', 'shelves', 'simple', 'visible', 'items', 'unit', 'classy', 'heavy', 'books', 'easy', 'use', 'customer', 'cst', 'units', 'sure', 'space', 'value', 'english', '4th', 'closet', 'weight', 'orderly', 'chromed', 'spanish', 'customer_service@whitmor.com', 'family', 'innovation', 'generation', 'language', 'practical', 'free', 'email', 'tier', 'durable', 'product', 'service', 'fashion', 'stackable', 'friday', 'sweaters', 'products', 'wall', 'tool', 'accessories', 'deep', 'accessible.whitmor', 'pleased', 'business', 'whitmor', 'assembly', 'integrity', 'versatile', 'organization', 'shoes', 'monday', 'everyday', 'chrome', 'promise', 'life', 'commitment', 'available', 'steel', 'areas', 'toll']"
CRESNEL Non-Slip Velvet Clothes Hanger - Set of 50 - Heavy Duty - Beige,"['Cresnel (TM) clothes hanger is made of durable material to provide long lasting use. The non-slip velvet surface coupled with notched shoulder will help keep clothes in position easily. Extra built-in holder allows hanging of tie, scarf or any small garment item. With this smart Cresnel hanger you can now pre-select a set of coat, pant and tie all in one single hanger. High quality assurance with 30 days money back satisfaction guarantee.']",CRESNEL,B01DLKO9TI,https://images-na.ssl-images-amazon.com/images/I/81ULlWeHTEL._AC_SX466_.jpg,4.9,10.0,"['duty', 'position', 'days', 'long', 'notched', 'small', 'garment', 'heavy', 'tie', 'smart', 'slip', 'use', 'coat', 'item', 'set', 'money', 'shoulder', 'material', 'durable', 'clothes', 'lasting', 'non', 'guarantee', 'satisfaction', 'surface', 'scarf', 'pant', 'velvet', 'high', 'single', 'holder', 'cresnel', 'hanger', 'quality', 'assurance', 'beige', 'tm']"
"Elf Stor 83-DT5011 1012 Christmas Bag-Extra Large, for a 9 Foot Artificial Tree in Red-Easy Holiday Décor Storage","['Clean up after the holidays are a snap with the Premium Red Christmas Tree Storage Bag from the Elf Story. A must have after the holiday season, an Elf Story Christmas tree bag will store your tree away neatly, effortlessly, and make for quick set-up next year. It is as easy as placing your artificial Christmas tree in the bag, zip it up and safely store it away until next year. Because our bag is a full 52 inches long, 30 inches wide, and 30 inches deep, you will have no problem storing un-assembled artificial trees and accessories up to 9 feet tall. The Premium Red Christmas Tree Bag has sturdy vinyl carry handles for easy transport. No assembly required, just unpack, unfold, and insert your tree. SATISFACTION GUARANTEED: Elf Stories committed to providing the consumer with the absolute best price and value on our entire line of products, which we ensure by applying a rigorous quality control process. NOTE: This is an exclusive product of Elf Storand ONLY Christmas Tree Storage Bags by Elf Story are GUARANTEED to be genuine. IMPORTANT: Avoid buying counterfeit products and transacting with unauthorized sellers. Look for our logo on the packaging for every one of our products. Specifications: EXTRA LARGE - Large enough to hold a 9 foot disassembled Artificial Christmas Tree. DIMENSIONS- 52 x 30 x 30 inch (LxWxH) - Soft Sided Duffel Storage Bag. PORTABLE - Durable nylon handles for easy carrying after the holidays. DURABLE - Strong durable tear-proof poly material with a heavy duty zipper. EASY TO USE- Clean up is a snap, just insert your 9 ft. artificial tree and store for years to come!']",Elf Stor,B009S94334,https://images-na.ssl-images-amazon.com/images/I/81BLLULUkgL._AC_SX569_.jpg,4.888888888888889,9.0,"['duty', 'vinyl', 'easy', 'dimensions-', 'nylon', 'value', 'proof', 'stories', 'material', 'snap', 'artificial', 'absolute', 'accessories', 'clean', 'bag', 'tall', 'holidays', 'un', 'entire', 'story', 'holiday', 'inch', 'consumer', 'specifications', 'years', 'packaging', 'best', 'storage', 'price', 'season', 'durable', 'bags', 'wide', 'unauthorized', 'strong', 'red', 'portable', 'duffel', 'control', 'counterfeit', 'year', 'elf', 'sellers', 'feet', 'genuine', 'tear', 'exclusive', 'poly', 'heavy', 'set', 'premium', 'process', 'large', 'product', 'deep', 'assembly', 'handles', 'foot', 'carrying', 'problem', 'zipper', 'christmas', 'line', 'quality', 'satisfaction', 'ft', 'sturdy', 'tree', 'long', 'rigorous', 'logo', 'inches', 'stor', 'important', 'quick', 'décor', 'lxwxh', 'products', 'trees', 'extra', 'sided', 'transport', 'storand', 'soft']"
AmazonBasics Garment Rack with Top and Bottom Shelves - Chrome,"['Chrome garment rack with 2 locking wheels Easy assembly (less than 15 minutes), no tools required Garment rack dimensions: 35x17.3x70.5 inches (LxWxH) Ships in Certified Frustration-Free Packaging']",AmazonBasics,B00H7P1FUU,https://images-na.ssl-images-amazon.com/images/I/71%2Bu%2BIfE8TL._AC_SY550_.jpg,4.888888888888889,9.0,"['minutes', 'packaging', 'tools', 'rack', 'lxwxh', 'ships', 'shelves', 'garment', 'chrome', 'frustration', 'assembly', 'inches', 'wheels', 'free', 'easy', 'dimensions', 'amazonbasics']"
AmazonBasics Mesh Wastebasket,['An Amazon Brand.'],AmazonBasics,B01AH488VQ,https://images-na.ssl-images-amazon.com/images/I/A1XkC6xtBPL._AC_SY741_.jpg,4.888888888888889,9.0,"['amazon', 'brand', 'amazonbasics', 'mesh', 'wastebasket']"
Snuggle-Pedic Zipper Removable Pillow Cover Kool-Flow Luxurious Bamboo Material - All USA Made (Queen Size),"['THE MOST LUXURIOUS AND BREATHABLE PILLOW COVER!', '', ""Our soft and Luxurious Kool-Flow Micro-Vented Bamboo Cover offers an unprecedented breathability that allows air to circulate through the pillow and keep you cooler all night long! The pillow case fits a Snuggle-pedic Queen Pillow and is fully zipper removable, so you won't have to wash your whole pillow as often. It is a perfect compliment to our Snuggle-Pedic Queen size pillow, one of the best selling pillows on Amazon!""]",Snuggle-Pedic,B019BRGC1S,https://images-na.ssl-images-amazon.com/images/I/61j9Tb%2BD1yL._AC_SY355_.jpg,4.875,8.0,"['usa', 'compliment', 'kool', 'unprecedented', 'pillow', 'queen', 'best', 'night', 'snuggle', 'material', 'cover', 'removable', 'perfect', 'pillows', 'bamboo', 'selling', 'breathable', 'flow', 'luxurious', 'amazon', 'breathability', 'zipper', 'pedic', 'air', 'size', 'soft', 'case']"
"WPM  60 x 63-Inches Sheer Window Elegance Curtains/drape/panels/treatment, Beige","['Give your home decor style, elegance and sophistication when you decorate with sheer window panels. Each vivid colored curtains have a warming effect on your home window treatment while provides privacy at the same time. Simple sheer yet add styling to your window.']",WPM,B00KTNPZIU,https://images-na.ssl-images-amazon.com/images/I/81i4eEK59gL._AC_SX425_.jpg,4.875,8.0,"['effect', 'panels', 'simple', 'sheer', 'curtains', 'vivid', 'time', 'style', 'sophistication', 'window', 'home', 'colored', 'treatment', 'decor', 'privacy', 'drape', 'elegance', 'warming', 'beige', 'styling']"
InterDesign Axis Towel Holder for Bathroom Vanities - Pearl Champagne,"[""InterDesign's hand towel holder is an absolute must in every bathroom and its a beautiful way to display your guest towels. It's perfectly proportioned base insures there won't be any tipping while you dry your hands. Slim, decorative and practical. The perfect accessory for your bathroom countertop. Display two fingertip towels beautifully. Impress your guests and add a touch of flair to your bathroom!""]",InterDesign,B00IF5T8UK,https://images-na.ssl-images-amazon.com/images/I/51JT7cnRyxL._AC_SX569_.jpg,4.875,8.0,"['hand', 'towel', 'touch', 'countertop', 'slim', 'decorative', 'beautiful', 'way', 'fingertip', 'practical', 'hands', 'proportioned', 'accessory', 'perfect', 'absolute', 'base', 'bathroom', 'vanities', 'pearl', 'flair', 'guest', 'tipping', 'holder', 'axis', 'guests', 'towels', 'interdesign', 'champagne']"
Wilton Elegant Swirls Wedding Invitation Kit,"['Easy as 1, 2, 3with step-by-step instructions to make your invitations look custom-printed! Includes: 50 invitations and mailing envelopes, 50 reply cards and envelopes, 3 test sheets.']",Simplicity,B0013EXP90,https://images-na.ssl-images-amazon.com/images/I/81-K0T1SLrL._AC_SX522_.jpg,4.875,8.0,"['elegant', 'instructions', 'wilton', 'reply', 'invitation', 'cards', 'kit', 'swirls', 'envelopes', 'easy', 'mailing', 'sheets', 'invitations', 'wedding', 'test', 'step']"
Insulated Lunch Bags for Women | Lunch Bags for Men | Lunchbox Adult | Cooler Bags Insulated | Adult Lunch Box by Ramaka Solutions | Non-Toxic Stain Resistant Nylon | 9.5 x 7.9 x 9.3 Inches Red,"['', 'Ramaka Solutions has completely organized your lunch experience', 'Our insulated lunch bag exceeds all comparable competitors lunch bags. Large main compartment holds stacked containers and still lets you add taller drink bottles; or use it as a cooler to carry 18-24 cans of your favorite thirst-quencher. Deep side mesh pockets have greater elasticity to accommodate even a 20-ounce water bottle. Eating utensils and condiments can be consolidated in the top flap mesh pocket, where an easy-pull zipper holds everything in place. Your phone and other valuables tuck away safely in the oversized front storage pocket. Never again dig around to find what you need.', 'The Ramaka Solutions Insulated Lunch Bag holds contents securely in place', 'All pockets and compartments have YKK easy-pull zippers. Our bag is constructed with the highest-quality materials. Insulation is non-toxic EVA as opposed to toxic PVC used in most products. The Nylon outer shell is assembled using heavy-duty double-sewn thread, yet has a pliable exterior for comfortable carrying. The detachable 48 shoulder strap includes an adjustable padded cushion for your comfort. Our lunch bag goes everywhere that YOU go: work, school, sporting events, camping, boating and beyond.', 'We strive to provide the best quality and customer service available', 'If you are not happy, we are not happy. If you have any issue at all with your product, simply contact us at Ramaka Solutions and we will resolve your issue on the spot with NO-QUESTIONS-ASKED. THAT is how confident we are that the Ramaka Solutions Insulated Lunch Bag is the LAST lunch bag you will ever have to buy.', 'Add the Ramaka Solutions Insulated Lunch Bag to your cart today.']",Ramaka Solutions,B011AVNEVE,https://images-na.ssl-images-amazon.com/images/I/61UhaFxTQvL._AC_SX569_.jpg,4.875,8.0,"['duty', 'camping', 'elasticity', 'toxic', 'school', 'adjustable', 'easy', 'customer', 'double', 'nylon', 'cooler', 'adult', 'shell', 'comfortable', 'place', 'bag', 'cushion', 'questions', 'zippers', 'mesh', 'comfort', 'events', 'bottles', 'solutions', 'greater', 'valuables', 'work', 'insulation', 'ramaka', 'taller', 'strap', 'insulated', 'best', 'exterior', 'padded', 'storage', 'outer', 'oversized', 'favorite', 'boating', 'bags', 'box', 'compartments', 'red', 'comparable', 'issue', 'women', 'spot', 'main', 'heavy', 'flap', 'bottle', 'cart', 'large', 'pull', 'shoulder', 'product', 'lunch', 'materials', 'thread', 'deep', 'compartment', 'competitors', 'water', 'carrying', 'cans', 'condiments', 'zipper', 'thirst', 'men', 'available', 'quality', 'phone', 'detachable', 'utensils', 'containers', 'quencher', 'resistant', 'pockets', 'eva', 'inches', 'today', 'pocket', 'non', 'service', 'experience', 'drink', 'products', 'pvc', 'confident', 'lunchbox', 'contents', 'pliable', 'highest', 'sewn', 'stain', 'happy']"
Golden Gate Grinders #1 Best Herb Grinder 2.5 Inch 4-piece Anodized Aluminum with Pollen Catcher – Large Black,"[""Presenting The Premium Line Of Golden Gate Grinders. The Ultimate Grinder Made Just For You! You asked and we listened! Our Amazon Number One Best Rated Grinder just got better. We added more teeth and made the reservoir bigger! Are you looking for a premium grinder at the best price? We are grinder users just like you. So we made the grinder you'd love, focusing on the best grinder for your money. HERE IS WHAT YOU GET! - Premium aircraft grade aluminum, precisely machined on computerized CNC machines. - Four piece grinder with micron stainless steel mesh filters out pollen. - Optimum 2.5 inch size, grind a lot herbs in one go. - Super sharp, well designed, correctly placed teeth for the best grind, does not rip or shred. - Powerful Neodymium magnets keep the lid on and leftover herbs fresh and odor free. - Textured sides on the lid give the best slide free grip when grinding your herbs. - Balanced weight, correct size and thickness of grinder and teeth. - Tough and reliable, lasts forever. - Silent Grind, smooth and quiet We know you will love it and if you do not - No Hassle Returns For A Refund. Buy from a company you can trust! And since we are the manufacturer we give you a Lifetime Warranty! Buy your Golden Gate Grinder now, you will love it.""]",Golden Gate Grinders,B00GXSFB1Q,https://images-na.ssl-images-amazon.com/images/I/81Xlpy9w91L._AC_SX679_.jpg,4.870967741935483,31.0,"['teeth', 'inch', 'neodymium', 'returns', 'sides', 'grade', 'thickness', 'pollen', 'magnets', 'silent', 'refund', 'users', 'piece', 'black', 'herb', 'premium', 'tough', 'best', 'cnc', 'reservoir', 'large', 'golden', 'catcher', 'ultimate', 'aircraft', 'machines', 'weight', 'price', 'money', 'filters', 'sharp', 'fresh', 'reliable', 'better', 'free', 'smooth', 'lot', 'powerful', 'gate', 'grinder', 'odor', 'slide', 'quiet', 'company', 'manufacturer', 'grip', 'aluminum', 'number', 'stainless', 'grinders', 'mesh', 'anodized', 'herbs', 'amazon', 'optimum', 'leftover', 'bigger', 'computerized', 'size', 'lifetime', 'grind', 'warranty', 'hassle', 'line', 'steel', 'lid', 'correct']"
"Lodge 2 Quart Cast Iron Dutch Oven. Pre-seasoned Pot with Lid for Cooking, Basting, or Baking","['The Lodge Cast Iron 2-Quart Serving Pot is a multi-functional cookware that works wonders with slow-cooking recipes and all your favorite foods. Cook up baked beans, soups and stews. This cookware piece goes from stovetop to tabletop for serving. Cast iron loves a campfire, a stovetop, or an oven, and can slow-cook foods without scorching. It retains heat well so you can sear meat at higher temperatures and will keep your delicious meals warm for a long time. Whether used in a kitchen or camp, theses virtually indestructible cookware should last for generations. Made of cast iron, this pot evenly distributes heat from the bottom through the sidewalls. Sporting a stylish black color, the cast iron cookware looks good in most kitchens and it doubles up as an excellent source of nutritional iron. This pre-seasoned cookware is ready-to-use right out of the box. While the cookware comes pre-seasoned to prevent food from sticking, it works best when sprayed or lightly coated with vegetable oil before use. The Lodge seasoning procedure is a multiple-step process in which the seasoning oil is applied via an electrostatic spray system that coats the cookware, then its baked in commercial ovens at very high temperatures. This allows the oil to penetrate deeply into the pores of the iron. This seasoning process achieves a seasoned finish that would take many months of home use to achieve. Sometimes during this process, the seasoning oil can collect and create a bubble or slight drip at the bottom of the pan as its hanging through the production process. And that in turn can turn brown as its processed through the seasoning ovens. This brown spot is not rust but in fact, carbonized seasoning and will darken with use. The factory seasoning process makes Lodge cast iron products ready to use right out of the box, and the product over time Just keeps getting better. After cooking, clean with a stiff nylon brush and hot water. Using soap is not recommended, and harsh detergents should never be used. Towel dry immediately and apply a light coating of oil to utensil while it is still warm. Cast Iron, like your grandmother used, still ranks as one of the best cooking utensils ever made. It gives you a nearly non-stick surface, without the possible harmful fumes generated by preheating chemically treated nonstick cookware. The American-based company, Lodge, has been fine-tuning its construction of rugged, cast-iron cookware for more than a century. Measures 8-inches in diameter and 2.875-inches deep.', 'There are lots of fancy cookware materials out there but cast iron still trumps them all with its even heating, heat retention, price, and duration. Its these traits that make Lodge cookware favored by both indoor chefs and campfire cooks alike. The caveat is being able to lift cast iron cookware and, at 8 pounds, this serving pot will give most chefs a workout. The pot measures 8 inches in diameter and 2-7/8 inches deep and comes with a matching 8-inch iron cover. The pot arrives ready to simmer up to 2 quarts of baked beans, soup, or stew and goes right from stovetop to tabletop for serving.', 'While it usually takes years of cooking to burn on the prized finish that makes cast-iron cookware smooth and stick-free, the Logic line of cookware comes pre-seasoned to save you some work. Cast iron pots in this line are coated in a vegetable oil, which is then baked on in a hot industrial oven to obtain that blackened patina and silky surface. Logic cookware has plenty of fans, including the editorial staff at Good Housekeeping, who cited it as one of the best new products of the year at the 2003 Good Buy Awards. --Cristina Vaamonde']",Lodge,B00008GKDU,https://images-na.ssl-images-amazon.com/images/I/91Ja-UxeuZL._AC_SX466_.jpg,4.861111111111111,36.0,"['heat', 'seasoning', 'turn', 'heating', 'seasoned', 'stick', 'cook', 'century', 'recipes', 'quarts', 'use', 'nylon', 'editorial', 'cookware', 'stews', 'plenty', 'industrial', 'buy', 'pot', 'indoor', 'indestructible', 'hanging', 'clean', 'surface', 'oil', 'oven', 'food', 'kitchens', 'silky', 'harsh', 'good', 'fumes', 'traits', 'tabletop', 'work', 'light', 'foods', 'system', 'excellent', 'dutch', 'campfire', '2-quart', 'generations', 'years', 'towel', 'best', 'fancy', 'fans', 'price', 'favorite', 'soap', 'duration', 'utensil', 'cover', 'procedure', 'finish', 'brown', 'pre', 'brush', 'pan', 'detergents', 'theses', 'box', 'basting', 'hot', 'grandmother', 'color', 'patina', 'vaamonde', 'workout', 'year', 'nonstick', 'wonders', 'american', 'pounds', 'iron', 'spot', 'bubble', 'factory', 'coating', 'months', 'piece', 'process', 'commercial', 'rugged', 'housekeeping', 'stiff', 'logic', 'construction', 'cooking', 'temperatures', 'new', 'multi', 'soup', 'product', 'company', '--cristina', 'possible', 'home', 'source', 'materials', 'drip', 'deep', 'vegetable', 'lots', 'water', 'high', 'harmful', 'staff', 'functional', 'baked', 'line', 'able', 'lid', 'cast', 'cooks', 'meals', 'camp', 'slow', 'long', 'pots', 'quart', 'nutritional', 'lodge', 'stew', 'production', 'utensils', 'time', 'ovens', 'measures', 'slight', 'spray', 'matching', 'black', 'step', 'ready', 'caveat', 'meat', 'multiple', 'electrostatic', 'stylish', 'inches', 'better', 'free', 'kitchen', 'prized', 'smooth', 'beans', 'higher', 'non', 'delicious', 'retention', 'products', 'chefs', 'rust', 'stovetop', 'soups', 'sidewalls', 'fact', 'diameter', 'warm', 'awards', 'pores']"
