title,description,brand,asin,image,rating,nReviews,keywords
"Fine Mesh Stainless Steel Strainers - Premium Quality - Set of 3 - Food Strainer & Sieve - Best for Kitchen, Tea, Rice & Juice Use - 5 Free Recipes eBooks","['', 'UPGRADE YOUR COOKING UTENSILS NOW WITH THIS TOP-QUALITY STAINLESS STEEL FINE MESH STRAINER SET- DONT SETTLE FOR LESS', 'Simply put, theres no higher-quality, 3 PC. stainless steel fine mesh strainer set. See for yourself why our rugged 3 PC. design with a mirror finished rims is chosen by chefs, internationally, for their own homes and commercial kitchens.', 'See The Benefits of This Top Quality, 15 lb Capacity, 3 Pc. Fine Mesh Strainer Set!', '- Top quality fine mesh makes this strainer set as ideal for skimming light stock & fruit pulp as it is for draining super heavy loads of pasta and other weighty food materials.', '- Strong 15 lb stainless steel construction combined with an attractive stylish look makes these fine mesh strainers perfect for both professional kitchen performance and optimal kitchen appearance.', '- Convenient hanging holes on each of the fine mesh strainers make for quick and easy storage/access, on home and commercial kitchen storage racks.', '- Long handles on these worry-free stainless steel fine mesh strainers leave you assured that these strainers are as safe in a dishwasher as they are over a burning stove.', '- Enjoy hands-free straining using the broad, mirrored brims that comfortably sit on top of pots and other similar broth and fluid catching objects.', 'GET YOUR PREMIUM QUALITY 15 LB CAPACITY, 3 PC. SILVER, FINE MESH STRAINER & SIEVE STRAINER SET TODAY!']",Kitchenismo,B01CMU1DCY,"['https://images-na.ssl-images-amazon.com/images/I/41fPq0GMs-L._SS40_.jpg', 'https://images-na.ssl-images-amazon.com/images/I/51qR0MBgobL._SS40_.jpg', 'https://images-na.ssl-images-amazon.com/images/I/41WLqfj1UUL._SS40_.jpg', 'https://images-na.ssl-images-amazon.com/images/I/51WupcQrGUL._SS40_.jpg', 'https://images-na.ssl-images-amazon.com/images/I/61q6Iw72qgL._SS40_.jpg']",4.857142857142857,14.0,"['best', 'pasta', 'kitchen', 'access', 'design', 'benefits', 'similar', 'optimal', 'stove', 'mirror', 'strong', 'objects', 'quick', 'attractive', 'higher', 'ebooks', 'rims', 'stock', 'broth', 'hanging', 'hands', 'light', 'use', 'stylish', 'fine', 'strainer', 'fruit', 'broad', 'brims', 'handles', 'steel', 'loads', 'lb', 'dishwasher', 'worry', 'capacity', 'construction', 'stainless', 'perfect', 'easy', 'strainers', 'heavy', 'materials', 'straining', 'homes', 'safe', 'assured', 'pots', 'pulp', 'performance', 'fluid', 'silver', 'premium', 'pc', 'look', 'food', 'storage', 'commercial', 'recipes', 'tea', 'ideal', 'sieve', 'catching', 'cooking', 'quality', 'rugged', 'free', 'holes', 'professional', 'mesh', 'long', 'chefs', 'home', 'juice', 'convenient', 'rice', 'kitchens', 'utensils', 'racks', 'today', 'appearance', 'set', 'weighty']"
Household Essentials ML-6692 Woven Water Hyacinth Wicker Waste Basket | For Bathrooms & Bedrooms | Natural,"[""Perfect for vanities and bathrooms, this wicker waste bin is an attractive, naturally vibrant addition to your space. Keep one in the office for paper waste and brighten your work environment with a little touch of the outdoors. Hand-woven and protectively coated to preserve the natural fibers, this beautiful piece is a simple and tasteful choice to meet every day's necessities. Item #ML-6692.""]",Household Essentials,B000P69NCA,"['https://images-na.ssl-images-amazon.com/images/I/51ztJS3BySL._SS40_.jpg', 'https://images-na.ssl-images-amazon.com/images/I/61Dz3ekIc8L._SS40_.jpg', 'https://images-na.ssl-images-amazon.com/images/I/61-Mtql9bUL._SS40_.jpg']",4.857142857142857,7.0,"['perfect', 'hand', 'household', 'water', 'vibrant', 'hyacinth', 'necessities', 'little', 'bedrooms', 'touch', 'piece', 'wicker', 'basket', 'vanities', 'choice', 'item', 'work', 'day', 'outdoors', 'tasteful', 'beautiful', 'environment', 'space', 'natural', 'fibers', 'waste', 'bin', 'essentials', 'addition', 'attractive', 'office', 'simple', 'paper', 'bathrooms']"
"Hog Wild Peeramid Bookrest, Sage Green","['Hog Wild was founded in 1996 and we live by these simple rules: We sell innovative novelty products typically geared to older kids (over 8) and that cross over to adults. We try to be different and dance to our own beat when developing toys and gifts. We avoid competition whenever possible (no board games, no fashion dolls, no flying disks). We don\'t do gag gifts but do enjoy humor and farting products (we just don\'t sell them). We\'re not the brightest bulbs in the warehouse but we do try and often own up to our stupid mistakes. We like things simple because it\'s easier for us to understand. We\'re located in Porkland, Oregon and ship all our products from this sometimes inconvenient location. We typically take 3 to 5 days to process an order for our retail stores and we like to get paid on time. If you\'re a credit worthy retailer, we\'ll offer you terms. If you\'re an ""end user"" we want you to buy from our website and we value you the most of all. I\'m sorry our prices are not dirt cheap but what you find from us, you should not find anywhere else. There are times when we get knocked off but that\'s life in the toy business. We\'re always on the prowl for new ideas and look to outside inventors for help. Most of the really good inventors are very hard to find and they are often bar tenders, school teachers, fireman, and other professions not typically associated with inventing. When we find these people, they typically have really clever, never before seen ideas. They are always smarter than we are and we feel very lucky when they license their product idea to us. Fact: The best products we have always come from outside inventors. If you\'ve got a great idea, we\'d love to hear from you. If you work at a professional inventing company with fancy presentations and 1,000s of great ideas, you\'re probably not a great fit for us.']",Hog Wild,B001KYU4BU,"['https://images-na.ssl-images-amazon.com/images/I/41D1iMOc83L._SS36_.jpg', 'https://images-na.ssl-images-amazon.com/images/I/414r7pj5vbL._SS36_.jpg']",4.857142857142857,7.0,"['location', 'things', 'dolls', 'stores', 'best', 'dirt', 'gifts', 'toys', 'inconvenient', 'fit', 'lucky', 'terms', 'good', 'prices', 'great', 'fashion', 'sage', 'adults', 'idea', 'smarter', 'easier', 'new', 'retail', 'fancy', 'porkland', 'sorry', 'teachers', 'older', 'innovative', 'website', 'credit', 'humor', 'wild', 'product', 'toy', 'clever', 'oregon', 'disks', 'competition', 'user', 'tenders', 'products', 'possible', 'peeramid', 'times', 'games', 'cheap', 'kids', 'mistakes', 'time', 'bookrest', 'fireman', 'professions', 'business', 'inventors', 'life', 'presentations', 'end', 'order', 'ideas', 'fact', 'help', 'outside', 'bar', 'ship', 'novelty', 'days', 'green', 'warehouse', 'professional', 'school', 'company', 'board', 'people', 'rules', 'bulbs', 'hard', 'brightest', 'retailer', 'prowl', 'hog', 'simple', 'beat', 'worthy', 'stupid', 'different']"
"Pinzon Signature 190-Gram Cotton Heavyweight Velvet Flannel Sheet Set - Queen, Cream",['An Amazon Brand.'],Pinzon by Amazon,B000FVW5Z2,"['https://images-na.ssl-images-amazon.com/images/I/81%2B4l8Dp7DL._SS40_.jpg', 'https://images-na.ssl-images-amazon.com/images/I/81Y04RW5LJL._SS40_.jpg', 'https://images-na.ssl-images-amazon.com/images/I/91sJCKnDNlL._SS40_.jpg', 'https://images-na.ssl-images-amazon.com/images/I/916WyXPCCJL._SS40_.jpg', 'https://images-na.ssl-images-amazon.com/images/I/91scNzmNK8L._SS40_.jpg', 'https://images-na.ssl-images-amazon.com/images/I/51L4gU1fELL._SS36_.jpg', 'https://images-na.ssl-images-amazon.com/images/I/61uwyIbvRJL._SS36_.jpg', 'https://images-na.ssl-images-amazon.com/images/I/51TzUMUhl3L._SS36_.jpg', 'https://images-na.ssl-images-amazon.com/images/I/51DPiiVU0SL._SS36_.jpg', 'https://images-na.ssl-images-amazon.com/images/I/51Xa1s54tFL._SS36_.jpg', 'https://images-na.ssl-images-amazon.com/images/I/61LZirnusgL._SS36_.jpg', 'https://images-na.ssl-images-amazon.com/images/I/51Dv5uq6%2B4L._SS36_.jpg', 'https://images-na.ssl-images-amazon.com/images/I/51G0p1M%2BW-L._SS36_.jpg', 'https://images-na.ssl-images-amazon.com/images/I/61ngusxCQmL._SS36_.jpg', 'https://images-na.ssl-images-amazon.com/images/I/514Gfl3JueL._SS36_.jpg']",4.85,40.0,"['queen', 'sheet', 'cream', 'cotton', 'heavyweight', 'set', 'pinzon', 'flannel', 'signature', 'amazon', 'velvet', 'brand']"
KitchenAid Professional 5 Plus Series Stand Mixers -  Onyx Black,"['Direct drive transmission and wide bowl capacity supply this mixer with the powerful ability to mix large batches of heavy batter and dough. Features the Power Knead Spiral Dough Hook and a 5-quart polished stainless steel wide bowl with handle.', 'Thirty percent more powerful than KitchenAids previous 5-quart stand mixers, this professional model efficiently tackles heavy loads with its 450-watt motor, direct-drive all-steel gear transmission, and bowl-lift lever that effortlessly raises heavy ingredients up to the beater. KitchenAid stand mixers, constructed of durable die-cast metal, come in a variety of colors and styles that have become American classics.', 'With a choice of ten speeds and three attachments--flat beater, spiral dough hook, and stainless-steel wire whip--the mixer handles everything from egg whites to meat loaf to pizza dough. Rather than rotating the bowl, KitchenAid stand mixers feature a fixed bowl with a unique mixing action: the beater spins clockwise as the shaft spins counter-clockwise, thus projecting the beater to 67 different points inside the 5-quart stainless-steel bowl. In deference to its power, the Soft-Start feature prevents splashing and flour clouds by gearing up to each speed gradually; then the electronic speed sensor kicks in to maintain a constant speed even when mixing the thickest batter. The bowl features a handle as well as two pins that hook into the lifting mechanism, which consists of a solid metal arm the same color as the mixer and a stainless-steel lever. A hinged attachment hub makes changing attachments easy. For safety, the mixer shuts down if an object obstructs the mixing process or if overloading occurs. The bowl, beater, and dough hook are dishwasher-safe. Assembled in Ohio, the mixer measures 16-1/2 by 12 by 14 inches and is backed by a hassle-free, one-year warranty. --Ann Bieri', 'Whats In the Box Stand mixer; 5-quart stainless-steel bowl; flat beater; spiral dough hook; wire whip.']",KitchenAid,B0001HLTTI,"['https://images-na.ssl-images-amazon.com/images/I/51B5QY90DHL._SS40_.jpg', 'https://images-na.ssl-images-amazon.com/images/I/41WPWWT2F1L._SS40_.jpg', 'https://images-na.ssl-images-amazon.com/images/I/51KWAEX95SL._SS40_.jpg', 'https://images-na.ssl-images-amazon.com/images/I/41Q5WTRACWL._SS36_.jpg', 'https://images-na.ssl-images-amazon.com/images/I/412PWW00VHL._SS36_.jpg', 'https://images-na.ssl-images-amazon.com/images/I/41XU2q7kAxL._SS36_.jpg', 'https://images-na.ssl-images-amazon.com/images/I/41XJ2QGYRCL._SS36_.jpg', 'https://images-na.ssl-images-amazon.com/images/I/41Wv-LIBg5L._SS36_.jpg', 'https://images-na.ssl-images-amazon.com/images/I/41sRFNlnKvL._SS36_.jpg', 'https://images-na.ssl-images-amazon.com/images/I/41%2BhlpNl5QL._SS36_.jpg', 'https://images-na.ssl-images-amazon.com/images/I/41PX81W36XL._SS36_.jpg', 'https://images-na.ssl-images-amazon.com/images/I/41nu8abQQIL._SS36_.jpg', 'https://images-na.ssl-images-amazon.com/images/I/41wehbSC0UL._SS36_.jpg', 'https://images-na.ssl-images-amazon.com/images/I/41CXDFN1JDL._SS36_.jpg']",4.846153846153847,13.0,"['--ann', 'start', 'onyx', 'mixer', 'classics', 'metal', 'beater', 'attachment', 'batches', 'direct', 'gear', 'pins', 'pizza', 'bowl', 'large', 'points', 'ohio', 'process', 'die', 'american', 'flour', 'previous', 'powerful', 'feature', 'black', 'kitchenaids', 'shaft', 'counter', 'lifting', 'speeds', 'ability', 'unique', 'box', 'polished', 'mechanism', 'percent', 'speed', 'color', 'spiral', 'solid', 'inches', 'hassle', 'steel', 'loads', 'model', 'hub', 'lever', 'sensor', 'dishwasher', 'capacity', 'attachments', 'power', 'loaf', 'stainless', 'flat', 'colors', 'easy', 'series', 'clouds', 'heavy', 'ingredients', 'safe', 'arm', 'meat', 'object', 'warranty', 'mixers', 'choice', 'wire', 'transmission', 'overloading', 'variety', 'styles', 'motor', '5', 'year', 'soft', 'drive', 'handle', 'electronic', 'deference', 'hinged', 'free', 'wide', 'professional', 'whites', 'action', 'thickest', 'lift', 'whip', 'safety', 'batter', 'supply', 'hook', 'egg', 'constant', 'kitchenaid', 'dough', 'stand', 'durable', 'different']"
"Lann's Linens - 120"" Round Premium Tablecloth for Wedding/Banquet / Restaurant - Polyester Fabric Table Cloth - Black","[""For exceptional presentation and drape that creates a lasting first impression, Lann's Linens sets the standard for the finest upscale, professional-grade wedding tablecloths. Constructed on a hydraulic loom from 180 GSM (grams per square meter) spun polyester, the result is a tightly woven, luxurious yet durable smooth-textured finish designed to resist staining and stretching for exceptional long-term wear and repeated use. This restaurant-grade tablecloth holds its shape and wont stretch or tear like inferior-grade fabrics.Instantly create timeless elegance for weddings, banquets, fine dining settings, buffets, and more, or use as a blank canvas for themed or ornate party table settings. Cut entirely from a single piece of fabric, this one-piece seamless design makes set-up and removal a snap. Popular serged edge design provides a neat, clean hemline that wont fray. Item is 100% brand new, first-run production. Due to the many variations in monitors and browsers, color samples may appear slightly different than actual product.Well-known within the national hospitality and restaurant industries, private wedding and banquet venues, and the party planning community, Lanns Linens is your trusted source for premium-quality, durable tablecloths that provide 5-star style at an affordable price.""]",Lann's Linens,B005EMQVCA,"['https://images-na.ssl-images-amazon.com/images/I/519%2BBo2ZZzL._SS40_.jpg', 'https://images-na.ssl-images-amazon.com/images/I/51FzXecb-XL._SS40_.jpg', 'https://images-na.ssl-images-amazon.com/images/I/51cbiZDcdNL._SS40_.jpg', 'https://images-na.ssl-images-amazon.com/images/I/511zJVM1tFL._SS40_.jpg', 'https://images-na.ssl-images-amazon.com/images/I/31zAppEGmdL._SS36_.jpg', 'https://images-na.ssl-images-amazon.com/images/I/31AFtDo7HIL._SS36_.jpg', 'https://images-na.ssl-images-amazon.com/images/I/31D97ko462L._SS36_.jpg', 'https://images-na.ssl-images-amazon.com/images/I/31TZ6Rq18pL._SS36_.jpg', 'https://images-na.ssl-images-amazon.com/images/I/31fuBdFFSpL._SS36_.jpg', 'https://images-na.ssl-images-amazon.com/images/I/31nkVrgOUuL._SS36_.jpg', 'https://images-na.ssl-images-amazon.com/images/I/31flabY4bKL._SS36_.jpg', 'https://images-na.ssl-images-amazon.com/images/I/31l17BaEFPL._SS36_.jpg', 'https://images-na.ssl-images-amazon.com/images/I/315wEyqZbsL._SS36_.jpg', 'https://images-na.ssl-images-amazon.com/images/I/316pclLNnWL._SS36_.jpg', 'https://images-na.ssl-images-amazon.com/images/I/31bqn61TeoL._SS36_.jpg']",4.833333333333333,6.0,"['impression', 'linens', 'drape', 'wedding', 'tablecloths', 'design', 'standard', 'themed', 'edge', 'monitors', 'private', 'party', 'single', 'round', 'product.well', 'shape', 'community', 'different', 'grade', 'black', 'exceptional', 'blank', 'hemline', 'new', 'banquet', 'variations', 'piece', 'popular', 'run', 'hospitality', 'dining', 'browsers', 'use', 'inferior', 'fine', 'color', 'result', 'lann', 'gsm', 'table', 'grams', 'seamless', 'luxurious', 'lanns', 'ornate', 'brand', 'price', 'premium', 'finish', 'production', 'restaurant', 'polyester', 'removal', 'industries', 'wear', 'canvas', 'affordable', 'planning', 'snap', 'cloth', 'style', 'finest', 'banquets', 'lasting', 'quality', 'neat', 'loom', 'square', 'upscale', 'meter', 'settings', 'textured', 'professional', 'item', 'timeless', 'long', 'actual', 'buffets', 'term', 'national', 'hydraulic', 'elegance', 'venues', 'set', 'source', 'clean', 'fabric', 'presentation', 'samples', 'durable', 'weddings', 'tablecloth']"
"Little Tikes Bright 'n Bold Table & Chairs, Green/Blue","[""Seamless, one-piece top is perfect for eating, playing, crafts and other projects Fully assembled Includes two child-sized chairs Durable Fun Easy to clean surface Complements Bright 'N' Bold Toy Chest; Made in USA"", 'By Little Tikes']",Little Tikes,B003VYAJMG,['https://images-na.ssl-images-amazon.com/images/I/41fOow3f97L._SS40_.jpg'],4.833333333333333,6.0,"['perfect', 'fun', 'seamless', 'surface', 'crafts', 'child', 'green', 'bright', 'little', 'piece', 'tikes', 'projects', 'chairs', 'bold', 'usa', 'chest', 'sized', 'blue', 'toy', 'table', 'durable']"
Positive Essence Thai Lemongrass Linen & Room Spray - Natural Aromatic Mist Made with Pure Lemongrass Essential Oil - Relax Your Body & Mind – Perfect as a Bathroom Air Freshener Odor Eliminator,"['', 'Thai Lemongrass', 'Eco-Friendly', 'Trusted Quality']",Positive Essence,B01CJRVMY4,"['https://images-na.ssl-images-amazon.com/images/I/419DBuEavGL._SS40_.jpg', 'https://images-na.ssl-images-amazon.com/images/I/415wpLfaoLL._SS40_.jpg', 'https://images-na.ssl-images-amazon.com/images/I/61jtwL8zslL._SS40_.jpg', 'https://images-na.ssl-images-amazon.com/images/I/41zRF%2BG8M4L._SS40_.jpg', 'https://images-na.ssl-images-amazon.com/images/I/31M6HQBYc1L._SS36_.jpg', 'https://images-na.ssl-images-amazon.com/images/I/21EnoLK%2BnLL._SS36_.jpg', 'https://images-na.ssl-images-amazon.com/images/I/31QtWp1YPtL._SS36_.jpg', 'https://images-na.ssl-images-amazon.com/images/I/31ZT6pnnfmL._SS36_.jpg', 'https://images-na.ssl-images-amazon.com/images/I/318fHgOCgLL._SS36_.jpg', 'https://images-na.ssl-images-amazon.com/images/I/31AtMsaLKmL._SS36_.jpg', 'https://images-na.ssl-images-amazon.com/images/I/31StWWqlnKL._SS36_.jpg']",4.833333333333333,6.0,"['perfect', 'linen', 'eliminator', 'quality', 'body', 'positive', 'air', 'odor', 'lemongrass', 'essence', 'eco', 'thai', 'friendly', 'mind', 'essential', 'spray', 'oil', 'natural', 'room', 'aromatic', 'mist', 'trusted', 'pure', 'freshener', 'bathroom']"
"Stainless Steel Kitchen Knife Set – 13 Piece - BONUS Sharpener - 6 Knives - Chef, Bread, Carving, Paring, Utility and Santoku Knife - Cutlery Sets - Multicolor by Lucentee","['LOOKING FOR HIGH QUALITY KITCHEN KNIVES THAT MEET ALL YOUR SLICING AND DICING NEEDS?', 'Lucentee Brings you the Solution: 6-piece Kitchen Knife Set with 2-stage Knife Sharpener', 'CONTENTS   1 x 4 Paring knife with blade guard   1 x 5 Utility Knife with blade guard   1 x 8 Carving Knife with blade guard   1 x 8 Chefs Knife with blade guard   1 x 13 Bread Knife with blade guard   1 x 7 Santoku Knife with blade guard   1 x 8 x 2 x 2 2-stage knife sharpener   Knife usage and sharpening guide', 'FEATURES', 'Knives:   Made from fine quality 3CR13 stainless steel   Laser finish   Non-stick coating   Dishwasher safe on top-shelf (hand wash for best results)   Ergonomically designed Polypropylene (PP) handles   Color coded with six different fantastic colours', 'Knife sharpener:   2-stage manual sharpening - coarse and fine sharpening   Precision angle guides   Easy to use - right or left handed   Ergonomically designed soft-grip handle for comfort and stability   Non-skid feet for safe sharpening   Product size: 8 x 2 x 2   Suitable for all stainless steel knives except the serrated bread knife', ""We've had EXCEPTIONAL FEEDBACK so far for this brand new Knife Set!"", ""HURRY, at this price stocks are selling fast and won't last!"", 'ORDER NOW to Avoid Disappointment and Enjoy the Benefits of Food Preparation with our Premium Knives!']",LUCENTEE,B014C2L3QG,"['https://images-na.ssl-images-amazon.com/images/I/516QDEV6XOL._SS40_.jpg', 'https://images-na.ssl-images-amazon.com/images/I/51-MvC%2B2iqL._SS40_.jpg', 'https://images-na.ssl-images-amazon.com/images/I/51uESV7y%2BQL._SS40_.jpg', 'https://images-na.ssl-images-amazon.com/images/I/413CAeag2QL._SS40_.jpg', 'https://images-na.ssl-images-amazon.com/images/I/41kvgEfANNL._SS40_.jpg', 'https://images-na.ssl-images-amazon.com/images/I/51zSmk9PdqL._SS40_.jpg']",4.833333333333333,6.0,"['feet', 'guide', 'guides', 'lucentee', 'best', 'colours', 'coarse', 'comfort', 'paring', 'kitchen', 'benefits', 'usage', 'sets', 'wash', 'coating', 'stability', 'utility', 'needs', 'exceptional', 'bonus', 'laser', 'multicolor', 'new', 'piece', 'pp', 'sharpening', 'manual', 'fine', 'color', 'angle', 'knife', 'steel', 'product', 'dicing', 'fantastic', 'serrated', 'cutlery', 'dishwasher', 'stainless', 'easy', 'carving', 'safe', 'slicing', 'skid', 'sharpener', 'polypropylene', 'brand', 'price', 'premium', 'finish', 'preparation', 'food', 'results', '2-stage', 'disappointment', 'santoku', 'contents', 'soft', 'handle', 'chef', 'hand', 'solution', 'quality', 'knives', 'high', 'shelf', 'right', 'blade', 'precision', 'stick', 'non', 'bread', 'chefs', 'stocks', 'feedback', 'suitable', 'size', 'grip', 'guard', 'different']"
"Cherioll Compression Copper Arch Support Brace - 2 Plantar Fasciitis Sleeves For Pain Relief, Heel Spurs and Flat Feet","[""100% pure food-grade citric acid cleaning powder. For use with reusable cleaning cartridge or E-cleaner only. FDA compliant chemical-resistant polypropylene jar. Made in U.S.A Per manufacture's instruction manual, use 1 oz (2 table-spoons) per cleaning. Please refer to operational manual for cleaning instructions. There are approximately 32 oz (32 cleaning cycles) per container. Due to the shortage of FDA compliant chemical-resistant polypropylene white jar, we will be shipping the order with FDA compliant chemical-resistant polypropylene transparent jar. We will notify our customers once the white jars are back in stock.""]",FOOTIU,B00U482GAA,"['https://images-na.ssl-images-amazon.com/images/I/51NG2neZ7vL._SS40_.jpg', 'https://images-na.ssl-images-amazon.com/images/I/51mAAFplrdL._SS40_.jpg', 'https://images-na.ssl-images-amazon.com/images/I/51ftv3hQqkL._SS40_.jpg', 'https://images-na.ssl-images-amazon.com/images/I/51H951AHXFL._SS40_.jpg', 'https://images-na.ssl-images-amazon.com/images/I/51T1mNFuRTL._SS40_.jpg', 'https://images-na.ssl-images-amazon.com/images/I/41CDZ9WJYGL._SS40_.jpg']",4.833333333333333,12.0,"['feet', 'jars', 'powder', 'compliant', 'stock', 'arch', 'plantar', 'cleaning', 'compression', 'spoons', 'container', 'polypropylene', 'e', 'citric', 'u.s.a', 'instructions', 'heel', 'acid', 'cherioll', 'copper', 'shortage', 'chemical', 'sleeves', 'use', 'fda', 'manual', 'cleaner', 'jar', 'cycles', 'support', 'customers', 'food', 'reusable', 'spurs', 'relief', 'operational', 'pain', 'instruction', 'order', 'manufacture', 'white', 'resistant', 'pure', 'grade', 'fasciitis', 'transparent', 'table', 'cartridge', 'flat']"
